text,label
とりあえず 急遽 ユニバ いけん く なっ た けど 、 落ち込ん で たら 連れ て 行っ て もらい まし た 何 から 何 まで 良く し て くれ て びっくり し た 感謝 だ なあ,1
ZIP ー FM High ! MORNING ! レゴランドチケット 当たり まし た ー !!!! MEG URU さん ありがとう ござい ます 自営業 です が 、 ばっさり 土日 店 も 休ん で 家族 4人 で 楽しん で き ま ー す,1
ＵＳＪ帰りに予約した君のうたの引き換えやっと昨日見つけたから次の休みにお迎え行きますたぶん（たぶん）,0
んでレゴランドいこう（？,1
ユニバ大作戦のアレってちんこが脳みそのやつと同じレベルだと思った,0
東京ディズニーランドハロウィーン2014まとめーNAVERまとめ<URL>,0
ミラクルニキ で 初 の ディズニー イベント 『 ミッキー & ミニーガチャ 』 開催中 ! 記念 無料 ガチャ で 豪華 報酬 を ゲット しよ う ! 詳細 は URL から チェック し て ね ! ユーザーガチャ 総数 7894 回 !! 詳細 は こちら ⇒< URL > # ディズニー # ミラクルニキ,0
夢 を 求め 続ける 勇気 さえ あれ ば 、 すべて の 夢 は 必ず 実現 できる 。 いつだって 忘れ ない で ほしい 。 すべて 一 匹 の ねずみ から 始まっ た という こと を 。 ウォルト・ディズニー … < URL >,0
4月 から の ため と 思っ て 、 強制的 に さ 早起き ? いや 違う か 私 が 予定 を 入れ すぎ て 結果 、 朝 早くから に なっ て て 夜 は 3時 とか 4時 位 まで 起き てる から 体 すっ っ っ ごく だるい ちなみに 今日 は 相方 と 2年ぶり ? とか くらい の レベル で ユニバ 。,0
ハウステンボス へ 行き たい ! JR か 西肥バス で 行ける よ ! JR で 行き たい 場合 は 大村線 の 長崎 行 快速 か 各駅 どちら でも 行ける よ 。 シーサイドライナー の 青い 列車 が 多く 走っ て いる よ 。 西肥バス で 行き たい 時 は 3番 乗り場 より ハウステンボス 行き に 乗っ て ね 。 西肥バス ターミナル より 長崎空港 行 で も OK!,0
いずみ の 質問箱 です 最近 回答 し た 質問 → 「 ユニバ 楽しみ すぎ 」 < URL >,0
"皆さんはどの寮がお好きですか？？
＃ＵＳＪ
＃ＵＳＪファン
＃きょたフォト
＃ｉＰｈｏｎｅ越しのきょたの世界＜ＵＲＬ＞",0
戴冠式のアナのドレスがモチーフ！ベルメゾン ディズニーデザイン「ドレス柄のキッチンマット」 － ニコニコニュース ＜ＵＲＬ＞ ＜ＵＲＬ＞,0
やった？！ユニバ行けるかも！,0
ディズニーに今度行くときは、もっと細かい計画たてなならんな（＝ω＝；,0
とりあえずユニバまでにいい感じに伸びていて欲しい,0
ディズニーでデートがしてみたい,0
【宮﨑想乃】豊永阿紀がハウステンボスでフィルムカメラを使い撮影したそのちんが美しい＜ＵＲＬ＞＜ＵＲＬ＞,1
ヤバＴピューロランドえぐい,0
これから の 季節 、 お出かけ は ちょっと ロマンチック に # 水族館 なんて いかが でしょ う ? # アクアマリンふくしま の 後 は 、 # イオンモール に 立ち寄る の も 良い です ね ♪ # ホテルミドリ # いわき # ハワイアンズ … < URL >,0
超特急チケットgoldenepoch行けなくなった為お譲りします。【譲】12/2612月26日大阪城ホール1枚fc1次ピクチャーチケットスタンドe10列以内【求】定価以下25日usj手渡し、振込、ラクマを…<url>,0
おバカなのでピューロランド見てから帰宅＜ＵＲＬ＞,0
ディズニー の アニメ は 、 小 動物 たち が 可愛い 。 みんな で シンデレラ の ドレス を 仕立て 上げる シーン すこ 。 < URL >,0
高級ホテル 好き 、 リッツ・カールトン 好き 、 そんな グループ ライン つくり たい ? どなた か 参加 し て くれる 、 優しい 方 、 い ます か ? あっ たら 、 楽し そう !,0
ポートレート撮影in東京ディズニーランドさやさん<URL>,0
"今日のユニモン
ズームレンズで撮りました。

＃ＵＳＪファン
＃ＵＳＪ  
＃ユニバ
＃ユニバーサルスタジオジャパン ＜ＵＲＬ＞",0
電車 、 明日 一緒 に ユニバ 行く 人 と 一緒 やっ てん 。 明日 の 話 とか すれ ば いい のに 普通 に 2人 そろっ て 爆睡 か まし た 笑,0
"ピューロランド
令和缶バッジ交換

【求】キラキラぐでたま
【譲】キラキラポチャッコ

キラキラぐでたまは買い取り（価格ご相談〇）でも？

難しいとは思いますが、よろしくお願いします＜ＵＲＬ＞",1
面白い けど その 子供 ら も キッザニア の 外 で は 消防士 で も 警察官 で も ない こと 知っ てる し 何より 大 多数 の オタク は キッザニア の 存在 を 知ら ない から 説得力 が ない,1
"ディズニーにカラス居たｗ
初めて見た（ディズニーの中で） ＜ＵＲＬ＞",0
【キャンペーンのボタンからツイートするだけで、応募完了？パーク招待やグッズなど？豪華賞品？がその場で当たる？さらに、応募者全員に限定壁紙プレゼント】私は、＃ハリポタライド完全版を体験した！あなたはどう？＃ＵＳＪ＜ＵＲＬ＞,0
3代目 と USJ に 行っ て 一緒に アトラクション 乗っ て 岩ちゃん に 自分 の メガネ 潰れ て も いい から 目隠し さ れ て 、 ギュッ と さ れる 人生 だっ たら よかっ た 。 笑 # 三 代目 JSoulBrその他 クリスマス DAPUMP さん と 関係 なく て すみません,0
花火大会行きた!!!!!上野のポテトレーラ?食べたい!!ディズニー行きた!!,0
"リトルドールたちの楽しそうなところ撮れた♪

「ディズニー マイリトルドール」：＜ＵＲＬ＞ ＜ＵＲＬ＞",0
? 配信中 ? イベ で 公式 アカ GET でき まし た ありがとう ? まだ はじまり の 町 すら 出発 し て ない 自称 舞台女優 だ よ ! 舞台 ? 歌 や ダンス ? おしゃべり バカ ? ディズニー ? が 好きな人 は 寄っ て らっしゃい 見 て らっしゃい! < URL >,0
更新 し まし た !【 どんどん 更新 !】 アンディーズストア 店長 雑記 ☆: ミッキー の ヨーグルトアイスーディズニーレシピ < URL >,0
まさかの ディズニーチケット いただき まし た !! ほんと ありがとう ! 楽しも う ね # 誕生日 プレゼント # ばい と なか ま ? # ディズニーランド # thankyou < URL >,1
ディズニー の クロスフェード 見 た けど 、 ほんとに ワクワク する ま ふさ ん の 儚い 高音 が 聞ける し 、 そらる さん の 優しい 歌声 が 聞ける … 発売 楽しみ だ ぞ,1
私が選ぶ#オペラ恋する夏のストーリーは「プレイフルな夏」おすすめリップカラーは、308サマーベージュ22ナチュラルピンク#operacosmetics#シアーリップカラー<url>,0
ハワイアンズ行ってみたいと思ったけど、行く人がいなかったわ,0
更新 し まし た !【 どんどん 更新 !】 アンディーズストア 店長 雑記 ☆: ?【 気になる! ?】 富士 祭り ディズニー < URL > < URL >,0
ジャニーズJr. が 公式 YouTube チャンネル を 持っ て 、 その 企画 として サンリオピューロランド を 訪れ て シナモン と お 友達 に なる 2018年 すごい,0
ミスターポライト が すき すぎる めっちゃ かっこいい よ ね この 人 が 一番 すき だ な でも 全然 詳しく ない から なあ # D オタ さん と 繋がり たい # ディズニー 好きな人 と 繋がり たい ? 画像 は お 借り し て い ます < URL >,0
ユニバ 雰囲気 だけ で 楽しい,1
すごい どう でも いい ん です けど サンリオピューロランド 今 なら 学生 2500円 で 入れる ん です よ 安い 3時 から 入れ ば 1500円 です すごい,1
イングラムとリボルバカノンを肴にヴァルシュタイナーをひっかける、オトナ！？のハウステンボス＜ＵＲＬ＞,0
"電車乗ると周りの人の会話って耳に入ってしまうやん。
ユニバ行く小学生の大群が横に来たんやが、会話内容のレベルの低さにほんまに笑ってしまった。
なんか自分もきをつけよう。",1
橋本 って どこ って 聞か れ て 、 ピューロランド に 行く 電車 だ よ 、 ピューロランド より 手前 だ よ って 色んな 人 に 言いふらし て た ( 言いふらし て た ? 笑 ) ん だ けど 、 ふつう に ピューロランド より 奥 や ない か ー い www デマ 流し た !( 笑 ),0
18 うーん 特に 嫌い な 性格 とか は ない か なぁ 19 Twitter 20 ライブ か ディズニー 21 足 が 短い 身長 170 無い その他 多数 、 、 悲しい なぁ,0
東京ドイツ村 イルミネーション きれい だ な,0
ここ の ホテル めちゃくちゃ 落ち着く し 、 居心地 良い ? 今回 は 1 泊 だ けど 、 次 は もう少し 伸ばそ う か な # マンダリンオリエンタル東京 # ホテル < URL >,0
弁天 町 は 俺 が 初めて 彼女 と 大阪 行っ た とき に 泊まっ た ところ 海遊館 と USJ 行く の に 近かっ た の と 治安 が 良 さ げ だっ た から 弁天 町 に し た 大阪 は 治安 が 悪い から 女 連れ て 夜 外 歩く だけ で 事件 に 巻き込ま れる らしい から,1
さっき の 続き 最高 の kawaii festival # 吉田 龍馬 # りゅう まさん # ピューロランド # ライブ エンターテイナー # 噂 の イケメンダンサー # ミラクルギフトパレード # 音楽 の 精 < URL >,0
関西 デ ? オフ会 めちゃめちゃ 行き たかっ た ???! ついで に ユニバ に も 行き たかっ た ? っ !! その 日 は わたし 国外逃亡 な ん だ … ! 11 / 24 オフ会 頑張る ねぇ,0
ディズニー 楽し みぃ,0
"仕事終わってからのマシンガントークがやばい
すんまんそーーん

あきがキッズみたいで可愛いぜキッザニア＜ＵＲＬ＞",1
"今日の２パレ、いとしのすーちゃん？
＃建畠すみれ
＃ピューロアンバサダー 場所： サンリオピューロランド （Ｓａｎｒｉｏ Ｐｕｒｏｌａｎｄ） ＜ＵＲＬ＞",0
TDS の ファッショナブルイースター に 行っ て き まし た 。 衣装 が とても 素敵 でし た 。 【 TDS 】 2015年 ファッショナブルイースター 衣装 まとめ 【 東京ディズニーシー 】 < URL > # TDS # ファッショナブルイースター,0
【ウインターグリーティングコート(美女と野獣ver)】【12/1818:00?販売スタート】【シークレットハニー】【ディズニーコレクション】【美女と野獣】【ベル】【コート】<URL><URL>,0
"チャイナランタンフェスティバル
ただいま開催中
２０１９・４・７（日）まで
会場＝東京ドイツ村内特設会場
（千葉県袖ヶ浦市）
入園料金（当日券）＝
大人２０００円
小人（小中学生）８００円
※別途、東京ドイツ村の入場料金（一台２５…＜ＵＲＬ＞",0
やばい ね 笑 歩き疲れ た 笑 今日 は 難波 ら 辺 を 色々 歩き まわっ た ばい ! 明日 から は 2日間 ユニバ ´ ω ｀* MARVEL すき やし ハリーポッター も 好き やし ! とにかく 楽し も ! < URL >,0
わいもユニバ行きたい,0
今夜4/1(月)#tkshibuya(#旧t2)受付にて【コウの#ゲストでsns】と言えば→\1000/2d\1500/1d+1s?(0時まで\1000/飲み放題+2d\1000)ゲスト希望はli…<url>,0
モンスターズインク 楽しかっ た ♪ ちょっぴり せつない 気持ち に も なっ て 、 ディズニーランド で モ 社 乗り たく なっ た !( 笑 ),0
ディズニーハロウィンで欲しいのあったかなぁ?,0
明日 ディズニー 行く けど 、 台風 どう な ん だろ う 。 風 が 強い くらい か な … 。 ショップ 巡り メイン だ から 、 大丈夫 か な … 。,1
カジノ だけ で 来る 客 も いれ ば ユニバ や 難波 に 遊び に 来る 客 も いる 。 それ を 理解 出来 ない と は 視野 が 狭い ね 。,0
ほ えー そういや 友達 も ユニバ で そういう の やっ て まし た わ 楽し そう だっ た,1
職場 の 人 に 貰っ た ミカン 飴 の 箱 が 可愛い //// ので ブルー ちゃん 入れ て み まし た ?? オーウェン ママ を 待つ ブルー ?? そして USJ の ラプトル 四 姉妹 キーホルダー も 大変 可愛い です //// 伝統工芸 みたい な 作り で ?? < URL >,0
ありがとう ござい ます 三 代目 と USJ 羨まし ? うち も … 1番 左端 の デニム ジャケット 着 とる 末っ子 、 かわい ?,0
とりあえず すき 結構 繋がっ て 長い けど 未だに お 会い でき て ない の つらたん 距離 が 憎い あなたのお茶 子 が すき な ので 私 と ヒロアカ やろ 、 、 あと 何 気 ピューロランド に 興味 が ある ので 一緒 に 行っ て くれ ませ ん か 、 、 ?(),1
私 たぶん 横浜市民 で 5番 目 くらい に イルミネーション が 好きなんだけど 、 よみ らん ガーデンプレイス 赤 レンガ けやき坂 ミッドタウン ドイツ村 なばなの里 は 元 彼氏 の 因縁 が あっ て やっぱり ちょっと まだ 行き にくく 感じる の は だいぶ ギルティ だ と 思う わ 、 、 本当 勘弁 し て ほしい 、 、 これだから男 は 、 、,1
【 悲報 】 レゴランド の クリスマスツリー 、 ヤバい < URL >,0
今日 は ユニバイベ だっ た の か ! TL に 流れ て 来 た だけ で めちゃめちゃ 感動 ! 今日 模試 頑張っ て よかっ た よ !,1
関空 で 驚き 、 奈良公園 で 感動 し 、 レゴランド で 感銘 を 覚え 、 「 ゆりかもめ 」 に 感心 ・ ・ ・ 中国人 小学生 の 日本 「 遊学 」 ーサーチナ < URL > 今回 の 経験 は 、 大人 に なっ て から の 夢や モチベーション に つながる ので … < URL >,0
今日 の 大阪 国際 フェスティバル の ロンドン交響楽団 で 、 フェスティバルホール を 100回 入り まし た が 、 101 ? 103回目 は ディズニー・オン・クラシック に なり ます ね 。 初めて の イベント な ので 、 とても 楽しみ 。 # フェスティバルホール # 100回 以降,1
もともと コンラッド へ の 気持ち を 消化 する ため に Twitter を 始め た ので そこ まで 配慮 する の は ちょっと しんどい です … やっぱり 自分 の 言い たい こと を 我慢 し たく ない し 、 既に 見 た 人 と 気持ち を 共有 し たい と 思っ て しまい ます 日記帳 代わり の Twi … < URL >,1
ユニバ に ルパン とか マジ ???,0
ミラクル☆ステージ『サンリオ男子』ＦＵＮ？ＦＡＮ？ＭＥＥＴＩＮＧ Ｖｏｌ．０に参加してきました？！本当に楽しかった！？吉澤くんのダンスがめちゃくちゃかっこよくて本公演が益々楽しみになりました？ピューロランドの空間が好きにな… ＜ＵＲＬ＞,1
飯窪バスツアーで日光江戸村いったときに買ったせんべいでのどごし飲むよ！＜ＵＲＬ＞,0
# ディズニー 好きな人 rt アリエル ?? < URL >,0
【 今日 の # ひかり の ピアノ 】 # メリーポピンズ # チムチムチェリー # 弾い て み た 物悲しい メロディー が 好き # ディズニー # Disney # chimchimcheree # Mary Poppins # カバー # Cover … < URL >,0
"最後にレインボークエストで青７引けて
今日来て良かったと心から思った
＃ユニバカ＜ＵＲＬ＞",1
結婚式 バタバタ 向かっ て おり ます ハウステンボス とか 何 年 ぶり やろ か とりあえず 楽しん で 美味しい もの 沢山 食べ て お酒 たらふく 飲ん で き ます 帰り は 終電 間に合わ なけれ ば 泊まり モンハン は 今日 一 日 おやすみ なので お 師匠 の こ … < URL >,0
♯ ディズニーシーディズニー 行っ て き まし た ! アトラクション は 、 なんと 15 個 も 乗れ て 、 すっごく 楽しかっ た ー ?_?) ヾ 綺麗 な 写真 も いっぱい 撮れ て 最高 だっ た < URL >,1
あら、またユニバ…,0
"【 NewArrival 】 ディズニー 刺繍 の Special オーバーオール が 入荷 し まし た ゆる っと 着 れる サイズ 感 も 文句なし の 可愛さ です ? これ は 争奪戦 の 予感 … ＼ 4 , 900 + tax < URL >",0
レゴランド 侮っ て た なぁ 普通 に すごい や < URL >,0
あ？ＵＳＪ行きたい？？？,0
初めて行くサンリオピューロランド,0
"てか、今年のハウステンボス
９月２２日やんね
その日運動会やんね
去年は夜のうちにいって
ハウステンボスまでゆっくりして
見に行ったんよね
今年できんくねそれ
筑後川はもーいいかなて思いよったのにハウステンボスはダメやろ
言ったら気持ちの問題ていいそう",0
10 . 20 ( 土 ) こす ぷれふぇすた in サンリオピューロランド アニソンディスコ 出演 ! アメブロ を 更新 し まし た # 世界 < URL >,0
コウ先生にぜひともユニバースを歌っていただきたい,0
"ウォルト？ディズニー？ワールド、フロリダ州オーランド２月の服装や持ち物リスト
＜ＵＲＬ＞
♯ディズニーワールド♯フロリダオーランド♯ディズニーワールド２月♯ディズニーワールド持ち物",0
東京出張が宮津でのイベントと被って悲しみ背負ってたけども、出張終わり午後から友達とピューロランド、さらに翌々日にディズニーに行けそうなかんじになったのでとても楽しみになった,1
ユニバーサル 届く の 遅い から タワレコ 買い に 行っ たら スペシャル カード 入っ て た んで から ユンギ 出る 率 の 高さ ww < URL >,0
これから の 時期 に イチオシ な ショー は なんと いっ て も USJ の 【 天使 の くれ た 奇跡 Ⅲ 】 只今 世界最高 の クリスマス ・ ショー を 間近 で 鑑賞 できる 「 特別 鑑賞 エリア 入場券 」 大 好評 販売中 ! 美しい 歌声 と ダンス で 綴ら れる 、 心 あたたまる 愛 の 物語 を お 見 逃 … < URL >,0
HIKAKIN と ディズニー の コラボ 広告 めちゃくちゃ すき (^_ ー ) ー ☆,0
強い 風 に 魂 を ハウステンボス に 運ん で もらい たい 真空パック の クリームチーズ 美味しい ん だ よ なぁ 。 おば ちゃん の 家 が 近く に ある ん だ から 行け ば よかっ た なぁー ( いや 、 娘 の テスト 前 に 行ける わけ ない じゃん ),0
知り合いの舞台に行こうと思ってた日日をスケジュール表に書かなかったからその日にディズニー行く予定入れちゃった、、土曜日舞台日曜ディズニーはキツい、、けど頑張ろう、！頑張れ身体？,0
シナモロール と ハグ それ は すなわち し ょっぴとの ハグ … ピューロランド に … 行か ね ば … うっ !!! < URL >,1
"２０代前半の息子を連れて３人でユニバきてる親子の親ふたりがそこら辺のカップルかのようにイチャついてるけど
息子凄いなって思う",1
USJ で 泣い た 話 を する と BTTF 最終日 エクストリームダンスモブ 千秋楽 サマーナイトパーティジョイオブライツ の メッセージ な ん だ けど 、 多い の か 少ない の か 。,0
あ 、 でも やっぱ 783系 ハウステンボス 号 の 旧 塗装 ( カラフル ) は 譲れ なかっ た,0
結婚式の二次会でディズニーのペアチケット当たったら、新郎新婦にビールかけてもいい権利ください,1
僕 の フォロワー が 東京ディズニーランド に 行っ たり 、 リニア の 試乗会 に 行っ たり 、 彼女 と セックス し てる 間 に 僕 は 英語 の 勉強 を し て い まし た 充実 し とる わ ー (),0
"ついさっきＵＳＪの年間パスが届いた～！
トランスフォーマーって最高かよっ！！
来月頭からの有効にしてるので来月ルパン行ってきます！ ＜ＵＲＬ＞",0
更新 し まし た !【 どんどん 更新 !】 アンディーズストア 店長 雑記 ☆: ?【 速報 です !】 カバー ごと 丸洗い できる ので いつ でも 清潔 ! ベルメゾンディズニーデザイン 「 授乳 クッション に も なる 抱き < URL > < URL >,0
今 でも 飯田線 を 走っ て くれれ ば … 。 幸い どれ も リニア鉄道館 に 保存 さ れ てる けど 。,0
ロンちゃんユニバ来て(切実),1
ミニオン って ディズニー で は ない 感じ です か USJ ?,0
1 泊 2日 で 大阪 行 って 来 まし た ー ! 道頓堀 や 通天閣 など 観光 し て 、 ユニバ に も 行っ て 来 まし た ? 覚悟 は し て た が めっちゃ 混ん でる w 特に この 日 は ハロウィーン イベント 最終日 だっ た みたい で 特別 混ん で た みたい 。 アトラクション は あんま 乗れ なかっ た … < URL >,0
"お互い行きたいとこ行けた旅行？？？？
＃東北＃福島＃郡山
＃ハワイアンズ 
＃ＧＲｅｅｅｅＮ
＃扉＃緑の扉
＃セブイレ駐車場から１年？ ＜ＵＲＬ＞",0
ミッキーの質問箱です最近回答した質問→「ディズニーの年パスいつくれるんですか?」<URL>,0
ディズニー の アトラクション 動画 見 て て 思っ た の は 1日 かけ て パーク に ある 隠れミッキー を 何 個 見つけ られる か を やり たい 。 とか 、 既に 多く の 人 が やっ て そう な こと しか 発想 でき ない 現在 の 時刻 は 4時 を 周り まし た 。 いい 加減 に しろ,0
昨日 は FC メン & APPO で マハ & ダンス カー ゆり たん あ すまん クリア おめでとう ? 今世紀 最大 死ん だ その後 ピューロランド ! みんな の お力 で とうとう 50歳 に なれ まし た ! ありがとう !! あと は 武器 ... パゴス から 出来 て ない ん です が … < URL >,1
ユニバ で まさかの 出会い ? コナン 大好き 同士 な お姉さま 方 と エスケープ 終盤 から 終わっ た 後 まで 、 ずーっと 語り まし た 楽し すぎ た … あむぬい かわいい … 同じ 赤井秀一 推し に あえて 語れ て 幸せ やっ た … < URL >,1
ずーっと後ろで拍手しながらスヌ見守るチャーリーおきゃわ#usjファン<url>,0
《元キャストが教える!》東京ディズニーシー・ハーバーショーの撮影方法実は意識されない光線状態おすすめのポジションは?【2018年8月更新】<URL>,0
コンラッドくん２位？,0
咲間夜空の質問箱です最近回答した質問→「ディズニー・ランド(シー)は好きですか?」<URL>,0
ハウステンボス で や 。 < URL >,0
USJ 日和 じゃ なかっ た !!! ジョーク だっ た !!! 土砂降り やっ た ? て 笑顔 で 言わ れ 、 と いう か そもそも 信じ て い た の が 私 だけ だっ た … 完全 なる 笑い話 … ! ジョーク の 見極め って 難しい な (^○^)(^○^)(^○^),1
ねぇ もう ツアー 発表 しよ ??? 不足 が 不足 し すぎ て 枯渇 が ひどい し 韓国 と 美瑠 ちゃん に 本格的 に 行っ ちゃう 前 に モチベ を 戻し たい ん じゃ !!! 言う て 9月 も ディズニー あっ たり 10月 も プリンシパル 円盤 あっ たり する から 小瀧 くん 大好き だ けど !! ジャニーズWEST が 一番 だ けど !! うん !,0
今日 も ユニバト お疲れ様 です ♪ 昼 電話 が !( ﾟ ∀ ﾟ ):∵ グハッ !! 今日 も 対戦 頂い た 皆様 、 ユニ メン の 皆様 有難う ござい まし た ?((。´ ・ ω ・ )。´_ _)) ペコリ < URL >,0
usjヘアポニーヘアゴム交換ワンピースonepiece譲ルフィ、フランキー、ウソップ、チョッパー、ロビン、サボ求ゾロ2:1でも大丈夫です。本日19時までusjに居ます!,0
妹 に また ディズニー に 行く の か ! アホ じゃ ない か ! って 言わ れ た けれど クリスマス も ちょっと 悩ん でる の よ お姉ちゃん …,0
ドイツ村 行き たい なあ ? よみ ラン でも いい けど 。 イルミネーション 見 に 行き たい よー,0
山下健二郎のさんがusjアンバサダーになるのが先か…ldhが自社目黒ランドを作り上げるのが先か…,0
