text,label
ちょっと 前 に ディズニー に 行っ た の です が 、 その 時 の 事 を まとめ て み まし た (^_^) # ディズニーランド # ディズニー # レジャー < URL >,0
去年 の ユニバ の ハロウィンナイト は キャスト さん に 友達 と 離さ れ て バリ 怖い 思い し た から 次回 こそ は 絶対 に 離れ ない と 固く 誓っ た,1
てかアルバムユニバで買ったけど絶対遅いよな,0
りゅとくんモバでusj呟いてるの一人だけだから、実家帰ってる可能性ある…?,0
"あぁ新大阪。
ここで降りたらＵＳＪ。
ミニオンミニオンミニオン

ねぇ、降りていい？
降りていい？？（／／？Д／？／？）ﾊｧﾊｧ？",0
仕事 落ち着い て き た ので ピューロランド 行き たい ! KAWAII KABUKI 観 たい ! ミラクルギフトパレード も !,1
今日学校終わって特に遊ぶ予定なければディズニー行こうかなとか思ってたけど、一眼忘れたしバイトもあるからやめよ。,1
ユニバ行きましょう爆笑,0
ユニバ は ディズニー より 空い て いる 。 ユニバーサルポートヴィータ 新しく て 快適 & 特別 に 朝食 が 追加 料金 なし で 夕食 に 変更 でき て ラッキー でし た 。 USJ から も そこ まで 離れ て ない 。 LAWSON も あっ て 便利 # USJ < URL >,0
レゴランドって雨の日でも遊べる施設あるんかな？,0
umストア限定web盤の販売が終了しますのでお急ぎください?umストア盤の特典会は8/12(日)ですが、販売終了が7/1(日)となってます?ユニバーサルミュージック本社にて個別握手会の開催は、初の試み?是非、この機…<url>,1
オフ会 いい よ ねぇ ー 9月 に ユニバオフ 会 を プテラ さん と 約束 だけ は し てる … 実現 出来 たら よい なー !!!!,0
人形作家の佐久間奏多さん。素晴らしい人形たちに完全にやられました。<url>,0
ほんで 今 から コナン くん と 安室 さん に 会っ て き ます USJ 、 最高 に 楽しい な !!!!!!!!!! < URL >,0
アメリカ の ディズニーランド で は 、 無許可 で 故人 の 遺灰 ・ 遺骨 を パーク内 に 撒く 人 が 続出 。 一番 人気 は ホーンテッドマンション 。 < URL > < URL >,0
更新 し まし た !【 最新 ニュース 更新 !】 ディズニー まとめ速報 :「 ピクサー ・ ショート ・ フィルム Vol.3 」 お母さん と 中華まん の 赤ちゃん < URL >,0
ＵＳＪに行きたくなる魔法にかかった．．．,0
あ、新大久保なんか行ってないでサンリオピューロランド行こう,0
若 かり し アルバス くん が ディズニープリンセス だっ た とき の マカヴォイ み たく ふわふわ 毛 の 儚 げ な 男の子 で そんな 清純 ボーイ の 純情 を 利用 し 踏みにじっ た 雄 みの 強い 顔立ち の 若 ゲラート くん ( 男子校 出身 )、 おお … 何 ?,0
いちご スペシャル 買っ て 無事 昼 頃 帰宅 し まし た ! 2日間 楽しかっ た ー !!! 遊ん で くれ た タグ の センス が ヤバい 軍団 ? 笑 シュラスコ めん つ ? 肉 めん ? 笑 ありがとう ?? ゆる スポ T 作ろ う ね ?? ディズニー も 楽しみ に し てる よ ん … < URL >,0
"ダナンの観光名所「バナヒルズ」
中世のフランスの町並みをイメージした一大テーマパーク！
でも、なんだかチョッともしかしてＵＳＪに似てる？！
アトラクションのゴーカートは自分でスピード調整できるなかなか斬新システム、スリリングですよ… ＜ＵＲＬ＞",0
LINE 交換 ⇒ いい よー 印象 ⇒ ひま トプ 画 ⇒ セクシー 好き な 所 ⇒ マニアック イメージカラー ⇒ 黄色 欲しい もの ⇒ お姉ちゃん 一緒 に し たい こと ⇒ ユニバ 地域 ⇒ 東京 職業 ⇒ 風俗,0
今日どうやら2人のフォロワーさんがusj行ってたっぽい一緒に行くわけないし、奇跡のニアミスやな,0
ハウステンボスに来ました。,0
そう そう ? 完売 し て まし た 、 奇跡 の 薔薇 ブロマイド 大 好評 に つき 、 再販 し ます ? クリアファイル と 合わせ て 是非 是非 ゲット し て ください ね # ハウステンボス # 奇跡 の 薔薇 < URL >,1
ＵＳＪいかなきゃ？,0
ちなみに この ディズニー の お 値段 は ワイ の 給料 より 高い です ( 真顔 ),0
"Ｃａの質問箱です
最近回答した質問→「次ユニバ行く予定は決まってますか？」

＜ＵＲＬ＞",0
"失敗したからって何なのだ？
失敗から学びを得て、また挑戦すればいいじゃないか。
【ウォルト・ディズニー】",1
な ず : 中学校 の 遠足 で ディズニーランド に 行き まし た 。 友人 と ミッキー 型 の 風船 を 買っ て 、 帰り の バス に 乗り込も う と し たら 「 おまえら ! 何 の 為 の 遠足 だ と 思っ てる ん だ !」 と 怒ら れ 、 風船 の 空気 を 抜か れ まし た 。 行き先 ディズニーランド で 、 一体 何 の 為 の 遠足 だっ た の か いまだ に 解 かり ませ ん 。,0
あまりに失礼すぎて笑ってしまった日本じゃないらしいので、ユニバ行かないでください,1
"ﾖｷさん２０１６年にハウステンボスでバンジージャンプしてたの…！？

その年の夏休みにハウステンボス行ってバンジージャンプ飛びかけてやめたんだけど飛べばよかった（；∀；）",1
"採用を強くし、経営を強くするイベントを開催します。
７／１８（水） 六本木・グランドハイアット東京にて。
＜ＵＲＬ＞ ＜ＵＲＬ＞",0
ユニバ の シャボン玉 出る ロッド 可愛い ん だ けど 結構 ちび っ子 達 が はしゃぎ ながら 上向け て 飛ばし てる ん だ けど 、 あれ って 顔 に かかっ たり 下手 し たら 目 に 入っ て 痛い 目 合う から 人 が 多い とこ で は 下 向け て 遊ぶ よう に 全体的 に 注意 喚起 し て ほしい なー 。 # USJ,1
2018年 最後 の 日 は ディズニーシー で 過ごし まし た 史上最大 の お土産 の 量 で 肩 が 外れ そう です あっ 、 今年 も よろしくお願いします ? ちなみに 年越し は 夜行バス の 中 でし た 寝 て まし た ((( < URL >,0
来月 ハウステンボス で ある ライブ の チケット を セブン で 発券 し て き た ん だ けど 店員 さん から 「 僕 も 行こ う か 悩ん でる ん です よ ね ?」 って 言わ れ て こっち は 行く って 決め てる の に どう 反応 すれ ば いい か わから なく て 「 有名 どころ くるし 行っ た 方 が いい です よ !」 って 関係者 で も ない の に 勧め て き た 、 、,0
"先週行った東京ドイツ村。

ＳＥＣＯＭしてた。＜ＵＲＬ＞",0
部活 の 奴ら が 、 3次元 アイドルオタク と 2次元 アイドルオタク と ゲームオタク と 無駄 に 金持ち な ディズニーリピーター しか い なく て しんどい けど 、 じゃあ 私 は 何 な の か と 言っ たら 、 もったいないばあさん だ わ 。 そんな の ( 私 ) と 同じ 類 の 人間 なんて い ない わ よ ね 。 笑,0
今日 誕生 日 の 人 おめでとう っ ! は ぴば ーユニバー から の フォロバ よろ,0
ピューロランドでなんかピンクピンクした乗り物乗った時動画撮ってたんだけど見返してみたら最高に頭が弱くて笑ってる,1
結局めちゃユニバにおった,0
しーちゃん の 誕生日 を ディズニー で 祈っ て き た ん だ けど 、 疲れ から か 虚無感 で すごい し 黒塗り の 高級車 に ぶつかり そう,0
ピューロランド２月誰か行こうよー,0
今 気付い た ん だ けど 空 だけ って パターン も ある ん だ ねぇ … やはり いくら やっ て も 味わい きれん ねぇ … アメリカ の ディズニーランド か な … ? < URL >,0
ルミナリエとユニバ行きたい。,0
"一緒にディズニーツムツムランドで遊ぼうよ！ＵＲＬをタップしてフレンドになろう！
＜ＵＲＬ＞",0
ユニバのクリスマスのＣＭって５年前ぐらいから毎年今年で最後って言ってない？？？,0
いい な 関東 に 住ん どる 人 は 最初 から できる 範囲 が 広く て 。 ディズニー に も 行き やすい し バイト できる や ろうし 遊び に 行ける 場所 も 多い し 芸能人 に も 会える かも やし 。 羨ましい 。 でも それ を 叶え たい なら 自分 が 今 の 状況 を 努力 し て 帰る しか ない ん や けど ね,1
なんか ユニバ の 年パス 登録 まあ まあ 時間 かかる やん 、 やから 事前 行っ とき たい やん 友達 の こと 考える なら カチューシャ も その 子 つける なら 買っ た 方 が いい やん 、 今更 感 や けど 、 なんで こんな 気 使っ てん ね やろ 自分,0
ユニバ の ハロウィン に 先輩 も 行き たい と 言っ た ので 一緒 に 来 まし た 。 チャッキー 怖い だろ う な と 思い まし た 。 怖かっ た です 。 17 体 ぐらい い まし た 。 サイレント なん たら も 怖い だろ う な と 思い まし た 。 腕 を つり まし た 。 怖かっ た で … < URL >,1
ディズニー シューズ [ VANS ] < URL >,0
"早く帰ろう思ってたら久し鰤に気が付けば閉園時間（笑）しかし腹減った
＃サンリオピューロランド ＃ピューロランド ＃ピューロ ＜ＵＲＬ＞ ＜ＵＲＬ＞",0
"仕事のご褒美にＵＳＪで買ったんだけど、可愛くて選べんかったーって言ったら君の可愛いの基準が分からないと職場の人に言われました…
だめ？可愛いくない？可愛いよね？（押し付け） ＜ＵＲＬ＞",0
1回 だけ 行っ た こと が あり ます 。 クッキーモンスター が 好き です が そこ まで 行き たい な と 思っ た こと は 無い です ディズニー も 同じく こんな 感じ 。 行っ たら 楽しい と は 思う 。 ピューロランド に は 行っ て みたい です ね 。 # peing # 質問箱 < URL >,0
ディズニーシー の 閉園 アナウンス これ 聞い たら 絶対 もう 1回 行き たく なる よ ね ? 最後 に 「 Good Night 」 って 言う の が まさに 夢 と 魔法 の 国 ?? # ディズニー # ディズニーシー ?? < URL >,1
一 人 USJ 、 一 人 ディズニー 、 一 人 海ほたる 、 一 人 バイキング とか やっ て ます 、 快適 です 。 # peing # 質問箱 < URL >,0
何 か ディズニー の グリーティング 待ち で 一眼 じゃ ない から ダサい 言っ てる って の Twitter で 見 た けど 、 一眼 持っ てる から 偉い と 思っ てる の か ? ただ の バカ だろ そういう 奴 って,0
さわめ○アイドルドラフトオーディション参加中○配信中!!<url>,0
いわゆる 初期 ディズニー の 5作品 の 中 だ と 『 ピノキオ 』 か 『 ダンボ 』 が 一番 支持 さ れ そう って 気 は する 。 『 白雪姫 』 は 歴史的 価値 だけ 。 『 ファンタジア 』 は 通ぶっ た 人 は 評価 し そう ( ここ まで 全部 偏見 ),0
大阪 旅行 、 最終日 ? 帰り たく ない ? アガッタリーナ に 行き たい ?? ユニバ 最高 だ ぜ ? って こと で 笑笑 最終日 、 観光 に 行き ます ? どこ に いこ う か なー ? # 大阪 # アガッタリーナ # EXILE # ベリーグッドマン # オバトン # ハンドリ # 楽しむ,0
明日も明後日もピューロランドいるから、会えたらみんなよろしくな？ッ！！！！！,1
ディズニーでミキフレ以外だと１００エーカーの森の仲間達が１番昔から好きなキャラで、そのあとスティッチが公開されて好きになって…ってまさかプーが１００周年を前に実写化するなんて思わなかったから嬉しくて嬉しくてたまらん…！,1
"＊リッツカールトン

昨日は予定があって
東京に行ってきました！

ホテルはランクを上げて
リッツカールトン東京？

東京タワーを見ながら
ディナーを頂きました

景色が最高すぎた！！！ ＜ＵＲＬ＞",0
ドラゴンボール を よく 知ら なかっ た 時 は 、 まさか 自分 が 劇場版 に しか 出 て こ ない マイナー キャラ を 好き に なっ て 、 挙句 その キャラ の イベント の ため に 初 大阪 ( USJ )、 初 スカイツリー する なんて 想像 も し て なかっ た 。 ぼく を 魅了 し て 止ま ない 罪深い キ … < URL >,0
あいぽん じゃ ない から スマホケース は 諦め 。 けど ディズニー 好き として は ミッキー と コラボ の は 欲しい なぁ ?。< URL >,1
7日 から 発売 の この ジャージ 欲しい 、 、 下 は 絶対 欲しい 、 、 これ 着 て ディズニー 行き たい 、 、 、 < URL >,0
手相占いの記事一覧-愛カツ<url>,0
"これから夜公演だよ！頑張ります？
＃フレンズオブディズニーコンサート
＃国際フォーラム
＃山寺宏一 ＜ＵＲＬ＞",0
この 前 の 東京 旅行 で ディズニーリゾート に 行き まし た ?(＇ ω ＇)? 久しぶり の 長い お 休み で 満喫 いたし まし た (*´ω｀*) < URL >,1
楽し そ ー !! 関東 来 て 今度 の 4月15日 で 丸 3年 ? か 。 早い なぁ 。 ( 熊本 震災 の 時 だっ た から 記憶 か すっごい 鮮明 ) な のに 、 1度 も 、 ディズニー も 、 ピューロランド も 行っ た こと ない っていう (´; ω ;｀) 名前 聞い た 事 ある バンド … < URL >,0
キッザニアたのしくてすき,1
昨夜 の 夢 は なかなか 楽しかっ た の です よ イツメン で ユニバオフ し て た ん です けど ね ? やっ た 時期 が ホラー ナイト の 時 でし て (_;) 昼間 は みんな わき ゃわきゃと パーク を 楽しん で たん です よ ところが 夜 に なる と 一転 怪しい 空気 が 漂う ん です そろそろ ゾンビ 達 が 出 て くる 頃 だ ね ? や だ なぁ 怖い なぁ ♪→,1
"ヤバヤバ凄い
ディズニーリゾート好きな人観て
てか聴いてだな笑
＜ＵＲＬ＞",0
ディズニー全部いい写真やなブレブレ率高すぎて笑うけど,1
最近一緒にユニバ行く子の大半が近鉄組だから西九条でバイバイなんよね?寂しいよね?,1
誕生日 に やん ちゃ ん が ディズニー 連れ てっ て くれる って !! 嫌っ て 言う やろ うなっ て 思っ たら いいよっ て ! 神 ぃい ー,1
"コンラッドモルジブランガリアイランド（モルディブ）
１泊約７１，０００円～。ラグジュアリーなバケーションが楽しめる高級ホテル。日本語スタッフがいるから旅行初心者も安心。ダイバーにはたまらないジンベイザメに遭えるかも！？＜ＵＲＬ＞",0
"レゴランド の 閉園 日 に は 気 を つけ ましょ う ! ※ 2019年 1月 6月 まで の 閉園 日 1月 : 1月8日 ( 火 ), 9日 ( 水 ), 10日 ( 木 ), 15日 ( 火 ), 16日 ( 水 ), 17日 ( 木 ), 22日 ( 火 ), 23日 ( 水 ), 24日 ( 木 )…< URL >",0
ディズニーで撮った写真をtinderに載っけてる女、絶対仲良くなれなさそうつまり女性の7割くらいとは仲良くなれません……,1
ショー パレ <<< アトラク っていう イメージ が 遠方 から すれ ば 当たり前 な の かも ね … でも ディズニー 行っ て 、 絶叫 物足りない よ ね って 言わ れる の は 違う と 思う 絶叫 の スリル 味わい たい なら 富士急 に どうぞ (^ q ^) ディズニー は ストーリー と 世界観 が 大事 な ん だ から (^ q ^),1
お客様には差し出せるものを全て差し出そう。場所をいつも清潔にしておこう。それから、いつもフレンドリーでいよう。本当に楽しめる場所にしよう。スタッフはこれを指示してくれていると思うし、続けていってくれると思う。そうだな、つまり、ディズニーがいなくなった後もね。－ウォルト・ディズニー,0
3月 ハウステンボス に いき まし た バイト 頑張り まし た 手伝い 頑張り まし た 誕生日 の 友人 の 家 に カチコミ 行き まし た,0
ピューロランド で 買っ た ぽち ゃっこ パーカー 暖かい から 愛用 し てる けど 、 冷静 に 考え たら ネタ で しか ない パーカー .... < URL >,0
人生 の ほとんど を 、 人生 の 望む 事 を し て 過ごし て き まし た 。 仕事 も とても 楽しい もの でし た 。 その 楽し さ を 仕事 の 場 だけ に 留め て おき こと が でき ない ぐらい に ね 。 ウォルト・ディズニー < URL >,0
"絶叫が絶叫で心踊るんだけど、この気持ちを理解して貰えない…
２人は地上待機、私１人で絶叫マシン…
なぜ分かり合えないのか分からない
＃四捨五入 ＃三十路男旅 ＃ＵＳＪ ＜ＵＲＬ＞",0
ディズニー 行っ て も ログ レス 遊ん で た 私 は 待ち時間 どころか 待っ て た こと に 気づか なかっ た ごめん な ゴーレム 達 、 ストーリー 武器 ほぼ 必須 とか ムカ つい て どうしても 勝ち たく なる やん (´ ・ ω ・ ｀),1
家族旅行 行っ て き まし た ぁ 1番 上 の お姉ちゃん は い なかっ た けど もぉ 覚え て ない くらい の とき に 行っ た っきり ユニバーサル 行っ て なく て ほんとに 楽しかっ た !!! 1日目 は 水族館 行っ て 道頓堀 行っ て 美味しい 食べ物 たくさん 食べ て ...? ほ … < URL >,1
"めんどくさｯ
でもこの歳であんな経験ないのもアレだな…とは思うけど、女とクリスマス過ごしたことも花火大会、フェス、花見、ディズニー、ユニバ、旅館どれも行ったこともないしペアルックしたこともない、あれ…何してたんだろ…ってくらいだか…＜ＵＲＬ＞",1
ダニエル 「 ヤンキー に 人気 の ない とこ 連れ込ま れ て 恐喝 さ れ た とき は 、 一瞬 死の恐怖 という もの を 感じ まし た よ … … 」 No.1 1 「 ヤンキー に 人気 ノ 無い … サンリオピューロランド で ス か ?」 ダニエル 「 違い ます 」,0
ユニバじゃん！いいなぁー、,0
"ディズニーハロウィン
＃スプーキーｂｏｏパレード
＃ディズニーハロウィン
＃ディズニー
＃ディズニーランド
＃ｈａｌｌｏｗｅｅｎ
＃ｄｉｓｎｅｙ
＃ｄｉｓｎｅｙｌａｎｄ
＃ｄｏｎａｌｄ
＃ｄｏｎａｌｄｄｕｃｋ＜ＵＲＬ＞",0
サッカー って しんどい ね … サッカー できる 体力 が なかっ た わ w 高校 の 時 の サッカー部 が ハワイアンズ まで 走っ て た の 納得 w,0
ぱぺちゃとディズニー行きたい,0
ディズニーシー の タワーオブテラー 内部 見学 ツアー が ある 。 案内 できる キャスト さん が いる か 聞い て みれ ば OK 。 所要時間 は 30分 ほど 。 乗り物 に は 乗れ ない けど 、 細かい とこ まで 凝っ て て すげ ー と 感心 する 。 # 有益 な こと を つぶやこ う Ruru 179,1
仁王 : ブン 太 と 喧嘩 し た 中 で 一番 衝撃的 だっ た の は 、 言い 争い の 中 突然 「 好き な ディズニーキャラクター は !?」 って 聞か れ て 適当 に 「 プーさん 」 と 言っ たら 「 テメェ は プーさん 好き で も プーさん は お前 なんか 嫌い だっ つ の !!」 って 唐突 に プーさん を 味方 に つけ て 罵倒 し て き た あの 喧嘩 じゃ な,1
ディズニーシー行きます,0
キッザニアの財布使ってた（）＜ＵＲＬ＞,0
ユニバ に キスマイ おる めっちゃ かっこいい ねん けど,0
【定期】ディズニーキャストを夢見る男子です☆ディズニー好きフォローお願いします!フォロバ110%/マックスオタ/受験生orz/ディズニーがないと死んじゃう人/とにかくディズニー大好き/twitter上にいるDヲタ全員と繋がるのが密かな夢だったりするのでとりあえずこれを見たDヲタは,0
今からディズニー向かいまーす,0
ハウステンボス 着き まし た ー ? # 副業 # アフィリエイト # ビジネス # 自由 # 独立 # チャンス # 投資 # お金 # 起業 # オプトイン # 仕事 # 稼ぐ # フリーランス # 在宅ワーク #お金持ち # 収入 # 脱サラ < URL >,0
ユニバーサル 基板 より も です よ ! 私 は !! 専用 基板 が です ね !! ほしい ん です よ !! ( 昨日 、 秋月電子 もう ちょっと 真剣 に 探せ ば よかっ た と 後悔 し て いる,1
今Ｍｙ ｄｒｅａｍｓ歌うのはあかん。しかもなにわ男子メインな感じでユニバるたこじ後列やん、、、そんなことさせたあかん,0
これ の 仕組み が 気 に なり ます が 、 QRコード で 1 チケット : 1 ユーザ を 紐 つける ん でしょ う か ね 不公平 な 状態 だけ は 避け て 欲しい です ね 東京ディズニーリゾート 、 スマホ で 「 ファストパス 」 取得 可能 に 今夏 から ー ITmedia NEWS < URL >,0
ハウステンボス行って純粋に花に癒されたい,0
ユニバーサル 行っ て まし た ( ? ω ? ) 初 フライングダイナソー が 最前列 ハリポタエリア 行く 頃合 いで 空 が 曇っ て き て 雰囲気 が 良かっ た と 個人 的 に サイコー でし た 美嘉 も やみ の まして 雰囲気 を 出し て くれ まし た ( ? ω ? ) < URL >,1
# もしも キッザニア に 行け た なら 小さい 頃 から の 夢 だっ た お 花屋 さん か な ? 子供 も 生まれ て 転職 自体 夢のまた夢 に なっ て しまっ た けど 、 キッザニア で 夢 を 叶え られ たら 、 現実 で も また 夢 を 見 られる 気 が する … ので 応募 し ます,0
Eテレ で 今 やっ てる 又吉 さん の 番組 、 ロケ地 ピューロランド の フェアリーランド シアター だ な ( ^ω^ ) 1回 しか 行っ た 事 ない のに 思い出深い から すぐ 分かっ た ?♪< URL >,0
9月 から の ハウステンボス は 夜 の イベント が 多い ので 、 昼 くらい に 来 て 夜 まで 遊ぶ か 、 夕方 来 て 一泊 する か でも いい けど 、 イベント が ある から 余計 に オフィシャルホテル は 高い ん だ けども,0
配属先が東京になったらサンリオピューロランドの年パス作って行きまくるって話してみたけど、笑われて終わった,0
ディズニーニュースまとめ：システム調整のお詫びで、いつもよりちょっと多めに回ってます？＜ＵＲＬ＞＜ＵＲＬ＞,0
クリスマス 年末 ディズニー とか 人 だらけ だ よ ね … ?? (?? ?????)?? ?? ホテル から シンデレラ城 眺め て 終わり で いい やっ て なら ない … ? なら ない か …,0
久々 の 出勤 すぎ て しんどい ぞ ヾ (⌒(_ × ω × )_ バタンキュー だれ か 今日 の 12時 から の 、 お 昼休み 中 決勝戦 の やつ の メダル 消化 付き合っ て くれ ぬ か の ぉ 。 ほんと この 5日間 、 ユニバ + 胃腸炎 で ほぼ やっ て ない から 、 冗談 抜き で 介護 なる けど www,0
先日 、 今年 4回目 の ディズニー 楽しん で き まし た 帰る 時 に 見 た ワールドバザール の プロジェクションマッピング が すごく 綺麗 でし た … … < URL >,0
映画 で 漏らす ほど かっこよかっ た レギス が なんか ちょっと アレ だっ たり したしも う この 際 1番 思う の は 「 ディズニー 様 サイド に ご 迷惑 が かから なけれ ば もん だ い あり ませ ん 」 だ よ ),1
暴論 :「 日傘 が 危ない なら 全員 が 日傘 を さ せ ば イイ 」 という 意見 は 「 全員 が 歩きタバコ すれ ば イイ 」 と 言っ てる の と 同じ です よ ? # SmartNews どっち も 暴論 じゃ ! だ けど 、 人混み … … ユニバ とか 梅田 とか ナンバ とか で 日傘 は マジで 危ない … < URL >,0
寝 にくい や ろ に 、 ユニバ からり ょたんちに 帰っ てる 間 これ で 寝 て た お 見送り さ れる の も 嫌 や けど する の も 嫌 や な ?。 梅田 で 1人 で 泣き ながら 歩い て た ?♀ 笑 < URL >,0
