text,label
"明日早出なのに…寝ないとあかん
でも眠れずヘッダーとアイコン変えた（笑）ヘッダーは２月に行ったハウステンボス オお陰様でとてもお気に入りのテーマパークになりました。で、アイコンは数日前のＵＳＪのドリンク。名前はハロウィンホラーナイトだっけな？混ぜたら闇が深くなりますｗ",0
昨日、一枚載せ忘れたのあった?名付けけて・・・センターハンド太ももww誰かツッコンでよww#エッチな写真#おはよう#裏垢#オフパコ<url>,1
ユニバト お疲れさま でし た ┏○)) サブ を 4戦 動かさ ない と いけ ない ぐらい 稼働 悪い です ( ;∀;) 動ける 人 щ ( ﾟ Д ﾟ щ ) カモォォォン # ユニバト 結果 報告 < URL >,0
当たったら… ＃家族と夏の想い出作り ？ＪＡＬ公式Ｔｗｉｔｔｅｒで東京ディズニーリゾートＲ新ナイトタイムスペクタキュラー「Ｃｅｌｅｂｒａｔｅ！ Ｔｏｋｙｏ Ｄｉｓｎｅｙｌａｎｄ」プレビュー鑑賞券が当たるＴｗｉｔｔｅｒキャンペーン実… ＜ＵＲＬ＞,0
真波 「 ピューロランド で キャラクター の こと 『 キミ 超 可愛い なぁ 』 って 言い ながら 撫で たら すごい 照れ て た から あと 2 、 3回 口説い たら 多分 おちる よ 」,0
【 カパル の 良い ところ 一 日 ひとつ ( 1844 )】 苦節 1年 ? 遂に # カパル も # ゆる 玉 フィフティーン 正式 仲間入り だお ね ( ピューロランド で お披露目 胸 熱 だ た おっ ☆ ) # ゆるキャラグランプリ 2018 元気 に 現地 決戦 へ … < URL >,0
"点字やイラストの凹凸で、さわって楽しめるユニバーサルデザイン絵本。

？ 全ての文字に点字付き
？ イラスト部分にも凹凸あり
？ 一枚の紙を折って作られている
？ 角が丸く、装幀が↑でホチキス等もついていないので安全
？… ＜ＵＲＬ＞",0
"好評 な ん だ 、 飯能市 に まさかの 人気 テーマパーク 爆誕 ? / “ 飯能 の ムーミンバレーパーク 、 まさかの 好 評価 に レゴランド 越え の 声 : 市況かぶ全力2階建 "" < URL >",0
ほ たち ぁ 、 今日 タキ サム お 誕生 日 だっ た よ ! 忘れ て た ァ ァ !( 夢の国 帰り な のに ごめん な … )( 今度 は 3人 で ピューロランド 行っ て ほしい み ) # ほた より < URL >,0
キャラ 楽しむ なら ディズニー 。 アトラクション 楽しむ なら USJ 。 そう 思っ てる ので 、 私 は USJ が 好き です 。 年パス めっちゃ 安い し 、 地元 の 人 羨まし,1
お土産 を 買い まし た ＼(*´▽｀*)/ saya さん に 教え て もらっ た ハウステンボス の チーザ 買い まし た ありがとう ござい ます ! に ゃん さん に 教え て もらっ た 清風 堂 の カステラ も 買い まし た よ ? ありがとう ござい ます ! さ せ ぼ さん も 沢山 … < URL >,1
なんか不思議なんだけど前回以上にディズニー行くって感じがする．．．,0
"先日ディズニーシーへ行きました。
ぷらぷらと撮影しながら周り、それを動画編集してみました。

＃ディズニー
＃ディズニーシー
＃動画編集
＃行った気分

ＹｏｕＴｕｂｅはこちら↓
＜ＵＲＬ＞＜ＵＲＬ＞",0
は っす ん と 恭平 が ユニバ 、 、 、 行き たかっ た 、 、 、 、 それにしても 最近 ほんと 仲良し だ ね ? ほんとに 大好き な コンビ ? もう 可愛い し 尊い し 会い たい です !! < URL >,0
猛烈 に ユニバ とか ディズニー とか 遊園地 に 行き たい … ミミ 付け て ポップコーン 食べ て ワイワイ し たい … ))) こんな にも 体調 悪い 日 に 限っ て 出かけ たく なる の は なぜ ?!!!!!,0
# 青春18きっぷ スタンプラリー 2019 春 、 今回 は 『 全部 カタカナ 駅名 』 で 無事 に コンプリート し まし た 。 ていう か 全部 委託駅 ちゃう ん か コレ 。 # ユニバーサルシティ # ハウステンボス # スペースワールド # ニセコ # マキノ < URL >,0
すっかり 夕方 。 ライトアップ の 時間 だ ね ! ディズニー を 探検 しよ う ! ディズニーランド と シー で 撮れ た 写真 を アップ し て い ます ☆ 同じ ところ で 写真 を 撮れ た あなた は ラッキー かも ? 難しい ところ も ある ので 探し て み て ね ♪,0
10 / 12 プリマハム さん の ディズニーシー 貸切 プレシャスナイト に 行っ て 来 た よ ? 走っ て 走っ て 色んな 乗り物 乗っ たら お土産 何 も 買え なかっ た (>?<)?? で も 凄い 楽しい 思い出 に なり まし た (??????)????*。 プリマハム 最高 ! あ … < URL >,0
【 a nation 2018 長崎 ハウステンボス 】 AAA FC の 一 次 先行 枠 です 2 連 番 で 博多駅 から の オフィシャルバス 付き です ( 博多駅 から の 往復 交通費 込み ) 急用 で 行け なく なっ て しまい まし た 定価 以下 の お 譲り も 考え て おり ます … < URL >,0
栃木市 蔵 の 街 ? から の 日光江戸村 遊覧船 で 癒さ れ 日光江戸村 の クオリティ の 高さ に びっくり ! < URL >,1
更新 し まし た !【 新アトラクション が 】 USJ まとめ 通信 【 楽しみ !】: ?【 話題 です !】【 ワンピース ・ プレミア ・ サマー 2018 】< URL >,0
ユニバのコナンコラボのやつぜったい行くでな,0
とりあえず ディズニー 好き と 海外旅行 好き と ネイルゴテゴテ 写真 は 全力 で 左 スワイプ する 運用 。,0
ユニバ 缶バッジ タブレット ファイル 交換 缶バッジ 譲 毛利蘭 遠山和葉 ジンシクレ 求 赤井秀一 安室 透 タブレット 譲 毛利蘭 シクレ 求 安室 透 ファイル 譲 灰原哀 シクレ 求 赤井秀一 安室 透 難しい … < URL >,0
ユニバ!!!楽しすぎたな??今日は皆てんきゅ!!いい写真いっぱいすぎる<url>,1
息子 を 幼稚園 に 預け て から USJ 行っ て 、 お迎え 時間 まで に 戻っ て こよ う と する と 二 時間 くらい しか 滞在 でき ない ん だ よ な ッ 待ち時間 少なけれ ば 良い ん だ けど な ッ 何 度 か 行っ て ギリ 無理 ! って グッズ だけ 買っ て 帰っ てる 期間中 は あと 一 回 しか 行け ない 最後 に 掛ける しか …,0
立ち回り が 重要 で ドラッグ なんて 後で いい なんて 聞い て も ね 、 モンスターズユニバーシティ の マイク な 自分 じ ゃどうしようもないんだすよ,0
ユニバ３年は行ってない,0
★無人島探検で奇跡が～！「エンジェルロード発見か？」★ハウステンボス★ ＜ＵＲＬ＞ ＜ＵＲＬ＞,0
1月27日「名探偵コナンエスケープ」体験しに行きます楽しみ?#ユニバ#usj#usjファン<url>,0
ごぼうね22日にねユニバいくんやけど、フォロワーさんの中で誰かその日ユニバいくよーって方!いらっしゃる、?((((((そんな幸せなことあるわけ<url>,0
なんか ハウステンボス の CM で 「 あり ー が と ぉ ー 」 とか いう から 「 あいし て ー る ー よー 」 って その テンション で 歌っ た 私 強い,0
なんと 神 の お 社 に !!!! 確か に 尾田 さん は ひょうきん族 の 全盛期 を 見 て いる 世代 ! どちら も 感動 もの だっ た 事 でしょ う 明石家さんま 、 『 ONE PIECE 』 作者 ・ 尾田栄一郎 の 自宅 に 招か れ た と 明かす 「 遠い USJ 行く より 楽しい ( 笑 )」< URL >,0
まっ て まっ て 今日 ディズニー で 浮かれ て て ZIP 録画 し て なかっ た ツイッター で 見 た けど しんど すぎる 、 、 早く 発売 し て ほしい,1
ディズニー いき てぇ なぁ ...,0
"ピューロランドめっちゃ行きたい。
誰か一緒に行きませんか？",1
【 朗報 】 レゴランド に 水遊び エリア 登場 ! 夏 限定 の 新アトラクション へ 急げ ! < URL >,0
絶対ユニバ行くだろみたいな人たちが続々と電車乗ってくる、,0
北 玉 で ディズニー 行っ たら 自分 は カチューシャ 断固 拒否 な くせ に 玉 森くん に は と びっきりかわいいやつ ( ジェラトーニ の w ) つけ させ て そう な 北山 くん が 安易 に 想像 でき て 全 私 が 泣い た … < URL >,1
うずしお が 見 られる 爽快 な 西海橋公園 なか で も 「 西海 の 丘 」 は 全景 が 一望 でき ます ハウステンボス から も 近い 長崎県 < URL >,0
ただ 最近 多い ヴィランズ は 全く 知ら ない … … あくまで 映画 が 好き で あっ て ランド が 好き か と 言わ れる と やっぱり ユニバ の 方 が 好き,0
謎 に たば ちゃんと ピューロランド 知ら ない キャラクター の カチューシャ つけ てる の うける 二 人 とも サンリオ そこ まで 興味 無い とか 言え ない 空間 で ある < URL >,0
大半 が ディズニー 好き,0
そりゃ レゴランド なんか 作っ てる から だ よ … 住む に は 結構 いい 所 だ と 思う けど な,0
今日 帰っ て 感想 かけ そう だっ たら 9月2日 スリーアウト ! ホームラン 篇 千秋楽 13時 公演 と 9月9日 ハワイアンズ スペシャルライブ の 感想 書き たい (>_<) 仕事 疲れ 過ぎ なきゃ いい けど (>_<),0
ディズニー の カウントダウン も 応募 し なきゃ ( 使命 感 ) さすが に どっち か 当たっ て ください,0
"ユニバト結果ぁ（＊？？？？？＊）？
今日わ朝からまったりさせてもらって最終戦だけ甘いひと噛みして２位っｗｗ
対戦ユニ様、ありがとぉございましたぁ？（〃・д・） －д－））ﾍﾟｺﾘﾝ
あっ！メンバー募集のｔｗｅｅｔでの沢山の皆さまの… ＜ＵＲＬ＞",0
あかん どー しよ 昨日 ユニバ で 1年間 ずっと 憧れ やっ た 人 に 会え た 。 。 ほんま に 可愛 すぎ た 。 。 今日 は 好きな人 の 試合 見 に 行っ て き ます !!!!,1
寒 さ に めげ て ライトアップ 観賞 も そこそこ に ハウステンボス を リタイア 。 メリーゴーランド の 係員 の お ねーさん が 超 可愛く て 、 凍死 し て も いい から 見つめ 続け て い たい と 思っ た ん だ けれど 、 本当に 凍死 し そう だっ た ので 勇気 ある 撤退 。 おかげ で 変態 に なら ず に 済み まし た 。,0
ユニバ の 亮ちゃん 頭 おかしい 可愛い 休み とっ て あげ た ー い 一緒 に いこ,1
はい ばか ハワイアンズ 行き ます 水着 で 風呂 も 入れる から 一 度 で 二 度 楽しい な 帰り に アクアマリン で 巨大 水槽 見 ながら 寿司 食べよ う ぜ ( 地元 は 福島 です ),0
デマ に 騙さ れる な! レゴランド の 正しい 楽しみ 方 + 値下げ 情報 ※ 随時 更新 ー NAVERまとめ < URL > # レゴランド # レゴランドジャパン # レゴランド 名古屋,0
大人 の キッザニア 、 債権回収 の スピード が 最重要視 さ れ そう だ し 、 法 付き 機関 より も 非合法 組織 に 頼る 割合 が 大きく なり そう 。,0
ドイツ村誘われてるけど涼太くんに会うのもうやめようかな（´・ω・｀）ボディタッチ多いしいい子なんだけどドキドキしない（´・ω・｀）,1
7歳 朝 から バレエ 発表会 午後 は キッザニア 色々 な 人 から 藤田ニコル みたい に なり そう で 可愛い と 言わ れる 。 我が 子 ながら 同 意見 だ < URL > < URL >,0
ＵＳＪに任天堂ワールド常設されたらいずれスプラトゥーンくるの必然だしな（ﾟ∀ﾟ）＜ＵＲＬ＞,1
診断結果 は 100% ミッキーマウス でし た ! あなた も やってみよう ! 【 今すぐ ! ディズニー 診断 】 あなた は 何 % ミッキーマウス ?| Disney DAILY < URL > ワロタ wwww,0
スマホを動かすと映像も動く！？ユニバーサルスタジオが公開したジェットコースター３６０°動画をスマホで見るとスゲェ！＜ＵＲＬ＞,0
友だちとディズニーとかユニバ行きたい。家族とはもう無理、,0
"【長良店】カリモク６０「Ｋチェアミニミッキーマウス９０周年限定モデル」が本日入荷しました♪店頭にて展示しておりますので、ぜひチェックしてみて下さい！
＃ディズニー＃カリモク＃ｋチェア＃限定＃ミッキー＜ＵＲＬ＞",1
鉄 の 人 なら 名鉄名古屋 と リニア鉄道館 、 ヒコーキ なら ちょっと 足 伸ばし て 787 初号 機 とか MRJ ミュージアム 、 車 なら 豊田 産業技術記念館 、 刀剣 の 人 なら 熱田神宮 とか 色々 ある やろ 。,0
ディズニー行きたいシー,0
大きな地震が起こるし特別警報出るほどの大雨で道路決壊して神社の鯉は町泳ぐし工場爆発して火事は起こるわ建物は爆風で被害受けるわオウム真理教の死刑執行されてディズニーパレード無くなった。１曲書けそうなことばっか起きてもうそろそろ日本終… ＜ＵＲＬ＞,0
御用聞き を 営業 と 思っ てる なら 、 ディズニーランド で も USJ で も 転職 すれ ば いい 。 夢を与える ほど 、 世の中 甘く ない,1
同じ 名前 の ゆきりん と 会い たい ヾ (⌒( ノ *? ω ?*) ノ ? Hatch で 会える けど 遠い よ 大阪 まで 近い のに 新幹線 代 は しこ ー し 高い の いつか ユニバ 一緒 に 行き たい ←( うち の 勝手 な 夢 な ん だ けど ね ww ),0
水中 の 暗い 感じ が 苦手 で 紅玉 海 の 深い とこ とか 湖畔 の 水中 とか アウト な ん だ けど 、 よく よく 思っ て み たら ディズニーシー の 海底2万マイル とか も そこそこ に 怯え て た や プール とか 海岸 くらい の 海 の 『 明るい 』 ところ は 好き だ けど 、 夜の海 とか 水中 深い ところ みたい な 『 暗い 』 ところ が ダメ,0
光州ユニバーシアードの開会式が３日に行われ、旗手の山本杏選手（柔道）を先頭に、日本代表選手団が笑顔で入場行進しました。大会は１４日まで行われ、日本は１８競技に３５８選手が参加します。（写真：アフロスポーツ）　＃ユニバーシアード ＜ＵＲＬ＞,0
妹 に 昨日 の ユニバ の ツーショ 加工 し て と 言わ れ た ので 加工 し たら 怒ら れ まし た … なんで ??? < URL >,0
明日のＵＳＪは、パーククローズです（ ´？？×？？｀ ）,0
１日限定“大人の”キッザニア体験する人たちの思いは…（´З｀）,0
"くるすももかのＳＨＯＷＲＯＯＭ配信中！
５月７日＠ｊａｍ最終予選！ｓｈｏｗｒｏｏｍ投票あります！皆の１票が必要！５月２０日ピューロランドライブ！こちらも投票制のライブ！みんな来てね！
＜ＵＲＬ＞",0
キングダムハーツ って スクエニ から めっちゃ お願い し て ディズニー と コラボ し た みたい な ( 語彙力 ) 胸熱 ストーリー 読ん で から ちょっと 興味 湧い てる,0
ｃｒｅｗ感出してユニバ？ ＜ＵＲＬ＞,0
ボドみてるけどちばしょディズニーか何か着てきたの？,0
ディズニー 行き た ? い 夏休み 誰 か 行こ ー !!!,0
たまびの山で鍛えすぎられていて、今までディズニーまでチャリで３０分かかっていたところ、なんと１５分でたどり着いた,0
"ディズニーの牧場ゲームをスマホで遊ぼうよ♪
＜ＵＲＬ＞",0
大阪 旅 も 終わろ う と し て ます しかし 、 現在 新幹線 が 遅延 笑 いい 三 日間 でし た ※ ユニバ は 入っ て ませ ん < URL >,0
もう 5年 も 一緒 に いる ん だ よ 、 、 次 は Disney か な ??? # プリント倶楽部 # プリクラ # コレカワ # コレカワ 2 # 渋谷 # 5年 の 仲 # next # ディズニー # いいね 返し # l4 l # bff # jk # jk ブランド 場所 :…< URL >,0
おはようございます？バイト嫌だ？？ディズニー行きたい？？？？,0
【 譲渡 】 ピューロランドメモミュメモボ MEMORY BOYS フェアリーランド 優先 入場 ピューロパス 譲 7 / 1 ( 日 ) 17 : 30 1枚 7 / 15 ( 日 ) 9 : 50 1枚 チーム アレグロ 5番 以内 求 定価 + 手数料 1 …< URL >,0
っていう 無駄 に 根拠 の ない 自信 持っ てる と ちょっと 人生 楽しい 。 ハウステンボス の サイト 、 見 てる だけ で 幸せ に なる 。,0
まじ で この 時 の 興奮 は やばかっ た なー ! バンド 生演奏 、 素晴らしい 演出 の 数々 、 ユニバキャラ 、 そして W アンコール 、 なんと 言っ て も Nissy の 歌声 と かっこよさ … これ を また 見れる なんて 最高 です … < URL >,1
先週は誰も彼もディズニー行ってた気がするけど今週は皆さんＵＳＪですか、、、楽しそうです、、、いきたいーーー,1
夏 は やっぱ 山 とか 川 以外 あまり 出かける 気 に なら ない から 秋 に なっ て ほしい 秋 の ディズニー 行き たい夢 見 たい,1
# もしも キッザニア に 行け た なら ずっと あこがれ て い た パイロット に なり たい です 。 本気 で パイロット に なり たい と 思っ て い た の です が 、 「 女 だ から … 」 と 周囲 に 猛 反対 さ れ 、 夢 を 諦め まし た 。 かっこいい 女性 パイロット に なっ て みたい です 。,0
スタヌ が ピューロランド に いる の 想像 する だけ で おもしろい,1
パリのディズニーランドのＧｏｏｇｌｅストリートビュー＜ＵＲＬ＞,0
"ディズニー・チャンネルのカレンダーにベイマックスがいる
＃ディズニー・チャンネル１５周年",0
< URL > クールジャパン @ USJ 限定グッズ 、 モンスターハンター ・ ザ・リアル の 腕時計 です 。 < URL >,0
テスト お 疲れ サマーランド 配信 テスト なんて もう やり たく ねぇ ... # PUBG # PUBG モバイル | < URL >,0
"ＫＩＳＡＫＩの質問箱です
最近回答した質問 → 「きさきりん
ユニバ楽しみにしてるよ！？」

＜ＵＲＬ＞",0
"グラマシーが学生でいっぱい。
スカートで座り込んでて
かなり無防備。
女性セキュリティも気にして
不審なカメラマンが居ないか
警備してくれてる。
＃ＵＳＪファン",0
更新しました！ディズニーの素敵な動画＆画像集：国際レベルで後進国や南極と比較しても日本でのＳｋｙｐｅは遅れに遅れており、これでは少女売春とイジメと若年層自殺が減少しな＜ＵＲＬ＞＜ＵＲＬ＞,0
知り合い から 借り た ハリーポッター を 見 てる 。 第 1 作 目 。 実は 映画 は ほぼほぼ 見 た こと ない という ( USJ は 友達 と 行っ た よ ☆ 賢章 先生 の 声変わり 前 の 声 クソ かわいい 正直 勃起 し た ( ベリアル しかし 声 に 全く 今 の 面影 が ない ので ダメ絶対音感 を 持っ て し て も わか ん ない ww,0
家から１時間ぐらいでサンリオピューロランドあるからアレやで,0
なおみ さん と ハロウィン USJ 行く こと に なっ て 楽しみ ー !! ホテルアルバート が すごく 気 に なる ん だ けど 1回 の 料金 が 高い … … この 値段 を 払う なら フェスタ・デ・パレード の 特別 エリア の チケット を 買い たい 気 も する …,1
たまにディズニープリンセス歌いながら踊って走り回りたくなる私はお姫様だからね!!!,0
ユニバこんなのしかいないなら行きたくないな～ただでさえ高いんだし,0
うち も 愛犬 と ハウステンボス 行き たかっ た 。 < URL > < URL >,0
テスト から の 解放 と 、 今日 部活 あっ た 事 へ の 嬉し さ と 、 明日 ユニバ な ので 私 は すごく テンション が 高い,1
"ＬＩＮＥで話すよりも直接喋る方がせるてぃは好きなんだけど
しかもそれゆったし、
なのにＬＩＮＥもっと頻繁に返してって
めんどくさｯｯｯハウステンボスｯｯｯ（失礼）",1
リニア鉄道館か･･･（青かった自分に敬礼）,0
普通にユニバ行きたかった人爆笑,0
ハウステンボス に 行っ て みたい な たぶん 行っ た こと は ある けど 物心 が つい て なかっ た っぽい ので 全然 記憶 が 無い,0
ディズニーランド行ったら、楽しまなきゃ楽しまなきゃで楽しめないタイプ,0
これ が ... こう じゃ !!! # ディズニー # 結婚式 # 招待 状 < URL >,0
えー .. ユニバ 行き たい .. こんな 夜中 に 急 に 寂しく なっ た,0
大阪 と 大坂 。 昔 は 『 大坂 』 と 書か れ て い まし た 。 しかし 『 坂 』 の 漢字 は 、 「 土 に 返る 」 と 縁起 が よく ない と なり 、 『 阪 』 の 漢字 が 使わ れる よう に なり まし た 。 USJ 『 戦国 ・ ザ ・ リアル at 大坂城 』 は 、 昔 の 漢字 で 縁起 が 良く ない と 言わ れ た 『 坂 』 です 。 縁起 は 大事 。 ビジネス 失敗 し ない よう に 。,0
(^^) 【 世界 的 な 栄冠 に 輝い た クリスマス ・ ショー いよいよ 今年 で グランドフィナーレ 】 # USJ 今 しか 会え ない 、 圧倒的 な 感動 の 心 あたたまる 愛 の 物語 。 【 ユニバーサル ・ ワンダー ・ クリスマス 】 1 / 6 まで 開催 … < URL >,0
夜行バスってほんとこんな安いんだwwでもなー大阪行ったらusj行きたいけどusjが高い、、うーん,0
家族全員で今日からＵＳＪなんだけど全員で行くとハムスターのお世話係がいないと言うことで私だけお留守番です（大泣き）,0
【 アニメ 】 アナ雪 の DVD は 英語版 も 見れる から いい よ ね 。 ディズニー の 歌 は やっぱり 英語 で 聞き たい ! と 、 いい や 日本語版 も 素敵 だ ぞ ! と 、 両方 の 気持ち を 叶え て くれる,1
今回のユニバのハロウィンは仮装するから楽しみやな？,1
福岡市 に 「 ららぽーと 」 核 テナント 、 「 キッザニア 」 を 誘致 市場 跡地 の 再開発 、 三井不動産 など 選定 へ ( qBiz 西日本新聞 経済 電子版 ) < URL > ヤバイ ! 近い し ! でき たら 絶対 いく ?,0
ディズニー 速報 アーカイブ : スターウォーズ EP 7 見る ンゴ # 2chまとめ # スターウォーズ # 映画 < URL >,0
なんか 、 ハワイアン イベント とか 出 て た から 、 遂に あの スパリゾート の ハワイアンズ の ステージ で フラ の イベント か と 思っ たら 、 小山 の イベント だっ た の ね すごい 勘違い し ちゃっ た,0
妖精 に なっ た 気分 ..?♀ ・ ? ・ # sanrio # sanriopuroland # サンリオ # サンリオピューロランド # ピューロランド # ハローキティ # hellokitty # かわいい # cute # love … < URL >,0
また ユニバ で 緊急 停止 か,0
予約 し た はず の カールトン の 代わり に 取っ て もらっ た < URL > 古い けど いい ホテル と 評判 良かっ た です 。 まぁ でも 確か に 格式 は あっ て も 古い ので 、 グランドハイアット とか と 比べる と 居心地 良く は ない です か ね 。,1
ユニバ は FF が 一番 楽しみ で 、 クラウド が 好き な ので 、 ノースリーブ の 服 を 手 に 入れ た !▼ 筋肉 な さす ぎわろたあと ブーツ は 暑い から 黒い でかい 靴 。 クラウド 風 に は なら なかっ た ( まず 整形 から 必要 ) < URL >,1
普通に考えて夏のユニバの最寄りホテル１か月切ってる時に予約取れるか心配にならないのか？？！？！って思ってしまう,1
コンラッド 大阪 の 真っ白 な スイーツビュッフェ & アフタヌーンティー が 可愛い ! < URL >,0
コンラッド の キャラソン が プレスリー の Love Me Tender で 、 それ を 森川 が 歌っ てる って だけ で やばい のに 、 この 曲 は コンラッド が ユーリ に 子守 唄 として 歌っ た 設定 で 、 そして 歌詞 の 日本語訳 … いつまでも ほん おう に 愛し て いる よ … < URL >,0
ディズニーランド に も 来 まし た !! この 時間 は キャスト さん い なかっ た です 。 ピューロランド と ポケモン とも コラボ し て ます !! # pr 666 # ニチョプロ # 彼岸花 毒 美 西成 観光 ツアー < URL >,0
