text,label
え 、 ピューロランド 行き たい 。 。 。 誰か 連れ て っ て ← 絶対 SKY ー HI 可愛い やん 。 いや 、 カッコイイ パターン も あり ?,0
大手 紙 による 選挙公約 の 検証 が 不十分 。 佐喜真 淳 氏 は 市長選 で も 菅 官房 長官 と ディズニー 誘致 公約 を 演出 。 「 ディズニー は 民間 施設 で あり 、 その 運営 に 政府 は 関与 し ない 」 。 今度 は 同じ 手法 で 携帯電話 料金 の 値下げ 。 # 沖縄県知事選挙 沖縄県知事選挙 … < URL >,0
2月 大学 に 受かっ て た 。 けど 飛び上がっ て 喜ぶ で も なく 山梨 の 祖母 の 家 で 鳥見 たり 、 YouTube で ラーメンズ 見 たり だらだら し て た 気 が する 。 写真 見返し たら あき たろ 、 と ー むと サンリオピューロランド いっ て た わ 。 ヒプマイ に ハマっ た の も 余裕 が 出 て き た この 辺 か,1
さっきまで旅行用のホテルとか調べてたからそこ行く気満々だったんだけど明日はユニバです......!!,0
ユニバです#peing#質問箱<url>,0
"NICONICO _ BAR , ユニバー 行っ て み たい 。 よく ニコバー と 見間 違え られる ユニバー 。 サメ が でかい ん だ っけ ?, 2015 ー 05 ー 25 01 : 48 : 47 , 0 , 9 ,< URL >",0
更新 し まし た !【 新アトラクション が 】 USJ まとめ 通信 【 楽しみ !】: → 【 速報 です !】 USJ 天使 の くれ た 奇跡 III ? T he Voices of an A n geil 2019 ・ < URL > < URL >,0
なぁ、日光江戸村って行ったことあるか？,0
僕 の 好き な 歌 の ジャンル かい ? アニソン に ボカロ … Jpop も 良い ね !! で も やっぱり ディズニー かな ぁっ ♪,0
p 活 する 夢 … 綺麗になりたい 。 エステ 行き たい 。 全身 脱毛 し たい 。 整形 し たい 。 美容院 行き たい 。 とりあえず 病院 代 。 かわいい 服 いっぱい 買う 。 デパコス も 買う 。 靴 や バック 。 ピューロランド とか USJ 行っ て み たい 。 高級 な 料理 を 食べ … < URL >,0
まゆ 、 ディズニープリンセス が めっちゃ 好きなんだけど も 最近 まゆ が 起き ない と ママ が 「 プリンセス ?、 起き て ?、 起きる 時間 よ ?」 って 起こし て 来る の 本当に 勘弁 し て 欲しい 。 わたし も う そんな 言葉 で 起きる よう な 歳 じゃ ない,1
今回 の 衣装 も 色々 と 上手く いっ た と こと か 駄目 だっ た ところ とか ある ん や けど 、 とにかく ウィッグ と 靴 も 含め た 一式 全部 が ユニバ の 袋 に 収納 できる ぐらい に 分割 が 成功 し た ので 満足 です < URL >,1
とある 業務 の お 勉強 で 連日 睡眠 3時間 。 立っ て て も 眠れ ます 。 そんな 中 、 今日 は ピューロランド で 春 恒例 の 演出 業務 でし た 。 で 、 振付 に またし て も 睡眠時間 を 献上 差し入れ 嬉しい です < URL >,1
サンリオ 垢 作っ て ない から この 垢 が サンリオ 垢 みたい な もん な ん よ 、 、 サンリオ の オタク さん と 繋がり たい な 、 特に まい めろ オタ と 繋がり たい … # サンリオ 好き と 繋がり たい # サンリオ 好き さん と 繋がり たい # サンリオピューロランド # まい めろ オタク と 繋がり たい,0
カリフォルニアのディズニーランドも行ってみたいなぁ。,0
本当に ありがとう ね ;_; 来年 は 高校 合格 し て 奈良 行 って すず と 会っ て 遊ん で お 泊まり し て ライブ 行っ て っ て する の ? ディズニー に も 行き たい ね って 話し た ! . 今 まで たくさん 話し て 共通点 とか も 見つけ て 似 すぎ て 双子 みたい だ よ ね wwww 本当に すず は 大切 な 存在 ?*。,1
ハウステンボス 旅行 !!!!! 当日 の 天気予報 は なんと 雷 ? それ が まる 2日 一 滴 の 雨 すら 降ら ず 良い 天気 に 恵まれ た って ゆう 奇跡 周り の 建物 は 外国風 で 素敵 な 所 だっ た なんせ 広 すぎ て みんな 自転車 で 行動 ( 笑 ) 歩い て 回っ た から しんどかっ た な … < URL >,0
ディズニー チケット 大人 の もの 買っ て くださる 方 探し て ます ! 手渡し だ と 有難い です ー 、 ディズニー 周辺 に おり ます ! # ディズニー チケット # ディズニー # 急募 # 舞浜,0
モイ ! iPad から キャス 配信中 ー < URL > # 初見歓迎 # 友達 募集 # 凸待ち # ディズニー,0
でも ね 、 動画 を 少し ずつ 見 て たら 数 秒間 な のに ミゲル いろんな 表情 し て た ちょっと 調べ たら 、 ディズニーアニメ は 1秒間 に 24 コマ な ん だって すごい ね,1
昨日 、 USJ で 、 コナン と キッド の マステ を 買お う か なー と 思っ た けど 、 断捨離 祭り を 思い出し て 辞め て おい た 私 偉い ? その 分 の お金 は 食べ物 と 経験 に かける の だ ー ( 言い訳 ) そして 、 写真 は 娘 が 飲ん だ シェイク 。 イースター 仕様 で 可愛い スヌーピ … < URL >,0
オラァ！！！！ピューロランドきたぞコラァ！！！！（このあとおさむが引っ掛けて死んだのでパゴスに帰った） ＜ＵＲＬ＞,0
兄貴 と 2人 で 21 と かなっ て USJ 行き ます ? ww てか 彼氏 おる なら 彼氏 と いけや って ゆ ー ww きもち わるい わ ー,0
休暇 中 だ な って 思う の は 、 いかにも USJ に 行く テンション 高 すぎ な 中高生 が 電車 に 乗っ て くる こと です か ね 。,0
ＵＳＪにすんごいざきやまくんに似た人いるんだけど。,0
気 に なる ん や けど 、 万博 の 入場料 いくら に なる ん やろ か ? USJ など と 同じ ぐらい ? 1万円 ぐらい に なる ? その 辺 が 気 に なる ところ 。 目安 でも いい から 、 公式 発表 し て 欲しい,1
子供 に 色んな 場所 に 連れ て 行っ て 、 沢山 楽しい 経験 を さ せ て やり たい 。 でも 、 安月 給 な 俺 に そんな 余裕 は ない 。 お金が無い と 、 自分 の 望む べき 事 が 満足 に 出来 ない 。 さぁ 、 ビジネス 起こし て 、 息子 を USJ に 連れ て いっ て 、 楽しい 思い出 作り ましょ う 。,1
おはやう諸君ハロウィンディズニーに行かなきゃって寝起きの瞬間に脳内に指令が届いたからディズニー好き集まって,1
ベビたん２回目のユニバはパパとママと一緒行ける模様,0
13日 に 約束 し て い た ユニバ も 行け なく なっちゃった から 、 さっき LINE し て き た ぁ (´?? ω ??｀*) 絶対 、 いつか リベンジ する けど ! いや 、 自分 が 悪い ん だ けど さ ... 楽しみ が どんどん 減っ て いく の は つらたん,1
明日ユニバなのに、大阪地震あっ…たん？？？？？？？？？？？？？？？？？？？？？え、こわ。え、明日行ける？？？？？？？？？？？？？？？？？？？？,0
だあーあったかくて幸せ花粉は辛いけど制服ディズニーしたいまだ20歳のうちに,1
ガチ の ガチ の ディズニーファン っぽい お姉さん を 見 て 、 格 の 違い を 感じ て 心 の 中 で 勝手 に 敬意 を 示す など,0
今日ディズニー行きたかった…,0
犬飼さんのツイート見るとディズニー行きたくなる…,1
魔法のディズニー画像をお届けっ！＜ＵＲＬ＞,0
再び雨のユニバーサル。 ＜ＵＲＬ＞,0
ユニバ 近く の ホテル とまっ てる よ ? タイムマシン みたい で めっちゃ かっこいい < URL >,1
ディズニー初の公式キャスト本！キャストの職種をすべて紹介！掲載写真６００点以上。キャストになりたい人にとって参考になるのはもちろん見ていて楽しい１冊に東京ディズニーリゾートキャストの仕事…＜ＵＲＬ＞,0
"ディズニーランド
今年初めてのランドに行ってきました。
風下にいたので、結構な水がかかりました。
珍しくキャラクターだけ
＃ディズニー
＃ランド
＃サマービート＜ＵＲＬ＞",0
本当に 寂し すぎる 明日 、 明後日 が 35周年 最後 の 土日 今 の 顔 が 最後 に なる 土日 や で ミッキー 、 ミニー が 悪い わけ じゃ ない 本当に 大好き な 気持ち は 変わら ない でも 、 本当に かっこよく て 、 可愛い 今 の 顔 が めっちゃ 好き ディズニー 行き だし て … < URL >,1
ゲームも楽しくてビンゴでディズニーチケットもらえてプレゼントも嬉しいものもらえて私のは愛しのまっちゃさんへ渡って時間があっというまに経ってしまったクリスマスパーティーでした企画ありがとう ＜ＵＲＬ＞,1
最初 に 出 た ニューフェイス の 写真 より 、 ディズニーファン の 表紙 の が かわいい と 思う 。 角度 の 問題 な の か ?,0
usj も ピューロランド も よみうりランド も ハロウィン だ から と ホラーテイスト に する から 私 は ますます ディズニー 以外 の 遊園地 に 行く 気 が なくなる 。 ホラー は 苦手 な ん だ よ … ホラー は 夏 でしょ う よ …,1
"そういえば今日
電車が遅れまくって
授業の途中から入ってきた人が
おったんやけど
その人曰く大学の最寄り駅の電光掲示板に１００分遅れって表示されてたらしい
１００分ってなんやねんユニバかよ",1
つか名古屋で開催できるようにすりゃいいんだよレゴランド潰してコンサートホール建てろ,0
"友達の家泊まったお陰で
ピューロランド３０分で着弾強い",0
13 最も 楽 に 稼げる アプリ 、 それ は 「 ハニスク 」 待ち受け で スライド する だけ な ん です 。 ↓ 招待 コード 【 USJ だいすき 】 # いいね し た 人 に やる # いいね し たら やる,0
3 最も 楽 に 稼げる アプリ 、 それ は 「 ハニスク 」 待ち受け で スライド する だけ な ん です 。 ↓ 招待 コード 【 USJ だいすき 】 # いいね し た 人 に やる # いいね し たら やる,0
友達 と 卒業旅行 に バナナワニ園 行こ う って 話し てる ん や けど どう 考え て も 10代 の 卒業旅行 って ユニバ とか ディズニー じゃ ない ? ウケる た の しみ Tシャツ と バナナ ワニ の ぬいぐるみ と キーホルダー ほしい,1
★ ディズニー ★ 【 ジャングルクルーズ に 登場 する 大蛇 の 身体 に 大きな 隠れミッキー が ある 】 すごい ☆< URL >,0
ハウステンボス に 500円 ? 1000円 ? ガチャ が ある らしい から そこら 辺 に 10万円 で ?? の やつ 行っ て 欲しい,1
人混み 無理 それ に ディズニー も 興味 ない # peing # 質問箱 < URL >,0
大人 の キッザニア めちゃくちゃ 行き たい けど 、 アナウンサー とか やっ たら 私 感極まっ て 泣い て しまい そう だ から 駄目 。 ちっちゃい 頃 から ずっと 、 アナウンサー に なり たかっ た 。,1
"サンリオピューロランド到着！！
もう駅に着いた瞬間から可愛い満載？ ＜ＵＲＬ＞",0
ディズニーシーの山のやつって怖いですか?,0
ユニバ 楽しい ー < URL >,0
ユニバーサル マン : この 前 、 腹 が いたく なっ て トイレ に 無心 で 向かっ て た ん だ が 途中 、 ふと ガラス に 映っ た 自分 の 姿 を 見る と 今 まで 見 た こと が ない くらい 男らしい 表情 で ワロタ,1
ディズニーに一緒に行ってくれる人欲しい,0
"長崎観光コースを考えなければ…
前回長崎言ったのは５、６年前かな
平和記念公園と、原爆資料館と、祈念坂、大浦天主堂、ハウステンボスに行ったハズ。あと島原城。
フランシスコ・ザビエルの教科書に掲載されてるやつを見た時は大興奮した記憶が。",0
環状線 に 乗り たい って 聞こえ た 瞬間 に あ 、 ユニバ だ なっ て 思っ たら あっ て た 皆さん どうか 楽しい 時間 を お過ごし ください have a good time !!,0
ゴリけん と パラシュート部隊 が 出 てる ...。 これ 全国放送 !? ハウステンボス いい なぁ 。 ピザ の 美味しい お 店 あっ た けど 今 も ある の か な ?,0
■キスマイＮｅｗｓ■【目撃】ユニバに藤ヶ谷太輔と横尾渉＜ＵＲＬ＞,0
2019年 ストリーミング 戦争 が やって来る ! ディズニー 、 ワーナー 参戦 で 映画 の 未来 は どうなる? < URL >,0
"『ユニバ．．．』
まっちゃん楽しかった。
ゾンビほんまに無理。 ＜ＵＲＬ＞",0
ウェラー 卿 は 絶対 予定 より 早く 帰っ て くる ( そう なる よう に 頑張る ) し それ で 陛下 は びっくり する 万が一 予定 より 遅く なる よう な こと が あれ ば 陛下 以外 の 前 で コンラッド の 機嫌 が 悪い,0
海 無し 県 の 民 な ので 、 乗っ た こと が ある 船 と いえ ば 、 ・ TDL & TDS の 船 全般 ・ 横浜 の 氷川丸 ・ 長崎 軍艦島 へ の 船 ・ 長崎空港 ← → ハウステンボス の 船 ・ 関西空港 → 神戸空港 の 船 ・ グアム で 乗っ た 船 ぐらい だ から 、 大きな 船 って の が 想像 でき ない 一番 大きい の は TDL の 船 … …,0
ハリーポッター とか 好きだ から 、 USJ いき たい な,1
ちょっと早いかな？と思ったんだけどディズニーがハロウィン始まってるからいいでしょ！！って安易な考えでハロウィン（ ヴィランズ寄り ）をイメージして作ってもらいました 横からだとあれだけど上から見ると一つの大きなキャンディに見える… ＜ＵＲＬ＞,0
サンリオピューロランド 行っ て 、 ましろ ちゃん の ポチャッコ に 会っ て み たい,0
"印象操作やめろ
アクセス数取りたいからってＵＳＪとディズニーの名前使うな
３日前くらいにド・ドドンパがパンクしたのニュースにした？
やるなら、全アトラクションやれ ＜ＵＲＬ＞",0
もうユニバで買わん,0
"シャングリラホテル東京の宿泊レポートをどこよりも詳しく紹介します！　＃東京　＃ホテルライフ　＃ホテル　＃旅行
＜ＵＲＬ＞",0
更新 し まし た !【 新アトラクション が 】 USJ まとめ 通信 【 楽しみ !】: ⇒【 コレ 知っ て ます ?】 USJ パワー ・ オブ ・ ポップ 2018 / 07 / 11 2回目 < URL > < URL >,0
"金曜日（１７日）はサマーランドへ！
「なつうた２０１８」
東京サマーランド 屋外プールサイドステージ
料金：ライブは観覧無料
※別途入園料はかかります。",0
"ネジきゅっ！なりきり時計職人　＃キッザニア ＃キッザニア甲子園 ＃毎日新聞 
＜ＵＲＬ＞",0
【キャンペーンのボタンからツイートするだけで、応募完了？パーク招待やグッズなど？豪華賞品？がその場で当たる？さらに？応募者全員に限定壁紙プレゼント？】私は、＃ハリポタライド完全版を体験したい！あなたはどう？＃ＵＳＪ＜ＵＲＬ＞,0
女子 必見 ! ディズニー の ウエディング グッズ 案 こんな 可愛い ウェディング グッズ に 囲ま れ て 結婚式 を 挙げる こと が でき たら ステキ ? →< URL > < URL >,0
大阪 は 商売 の 街 や から 大変 や し 、 なに より 大阪 の いい ところ は ユニバ と 友達 が いる こと くらい やし,0
【 交換 】 あんさんぶるスターズ! あん スタコラボサンリオピューロランド 丸 缶 バッチ 2 【 譲 】 Ra * bits 、 紅 月 【 求 】 ライハ 各 2 > Knights 出来れ ば 、 絡め て 交換 希望 です 。 フォロワー 様 優先 です が 、 FF外 から … < URL >,0
という わけ で コンラッド と ライアン の 仲 が 深まっ た おめでとう 。 プラトニックラブ し て ほしい 。 いや セッ も し て ほしい けど 。,0
生理 や から イライラ 7割 り 増し じゃ ボケ ????? 4 / 6 レペゼン 地球 サンリオピューロランド ライブ チケット 1枚 余っ て い ませ ん か,0
"で、そんなことを考えながら、隣のディズニーストアに入るわけです。。。切り替え早すぎるよね、わたし。
何も買ってないけど、ドナ誕グッズ可愛かった！マフラータオルとシュシュ欲しい？",0
今日は真顔でディズニーシー来てるよ？ ＜ＵＲＬ＞,0
下の階というと、私が行ったことあるのは椿山荘とペニンシュラですけど、ペニンシュラは値段結構するので、やっぱり最初は椿山荘がオススメですかね！味はどこが美味しいとか私はよくわかりません可愛ければ良い,1
金曜でもないやwwwツイ消ししてもう1回木曜日に行ったディズニーなのに間違えて今日行った風に書いちゃったよねwwしたらみんな合わせてくれたww持つべきものは友やわ。最高,1
ドリームアートワールド ! ディズニー アート ! すごい 作品 が 沢山 あり まし た 。 ホール 内 BGM も 高まる 曲 で 幸せ でし た 。 < URL >,1
【 定期 な 呟き 】 Disney 関係 で フォロー くださっ た フォロワー 様 へ ★ ツイ 主 ディズニー も 大好き です が 、 アニメ 漫画 関連 の 呟き が 多い です 。 フォロー の 際 に は お気 を 付け ください 。,1
・ カルマ 闘神 シリーズ 四 体 目 ね 。 重力 、 ブロック 対応 で ユニバキラー も 所持 し てる わ 。 友情 は この 時点 で は 初 だっ た 超 強 貫通 ホーミング 8 よ 。 ヨミ 零 など で 使える わ 。,0
大佐：皆でディズニーランドへ行った時、リトルボーイは「シャッター押して」とミッキーマウスにカメラを渡したんです。＃コピペガン,0
GW ど 真ん中 の 5月2日 に 仕事 が 入っ て しまっ た ショック と いっ たら 。 。 。 ちょうど 京都 に 行こ う と 思っ て 予約 し て い た リッツカールトン 京都 が 。 。 。 残念 すぎる 。 さ どう し た もん か な 。,1
あーー早くユニバ行きたい,0
今日ユニバ行く人？♀,0
ツムツム ぬいぐるみ 【 スター・ウォーズ 】 ストームトルーパー ミドル ( M ) ディズニーストア STAR WARS < URL >,0
ペッパーＦＳやいきなりステーキに少しでも興味がある方は必読の内容（３部作）。後、オカダマニラにペッパーランチが入ってるので、オカダマニラ関連銘柄でもあるので、ユニバホルダーも必読のはず（笑）,0
"３５周年ディズニーいきたいーーーーーーーーーーー
テーマパークのとこのホテルに泊まりたいーーーーーーーー",0
"＃ハウステンボス
離脱…

お仕事にしゅっぱーつ

元気出して
いきましょ

＃吉田要士さん＜ＵＲＬ＞",0
＃ディズニーシー  方向音痴には辛い作り。特に山？の所。迷路っていうアトラクションかと思ったわあと高低差ね。それが美しい景観を作っているのは分かるんだけれども、２Ｄがダメな人に３Ｄは無理,1
更新 し まし た !【 新アトラクション が 】 USJ まとめ 通信 【 楽しみ !】: ?【 最速 ネタ !】 ニューヨーク・エリア < URL >,0
レゴランド 、 フード が 美味しい です ! < URL >,0
Ｎｅｗｐｏｓｔ（専科「パパ・アイ・ラブ・ユー」）ｈａｓｂｅｅｎｐｕｂｌｉｓｈｅｄｏｎアートコンサルタント／ディズニーとミュージカルのニュースサイト－＜ＵＲＬ＞,0
ナイスインホテル市川東京ベイ ＜ＵＲＬ＞ ＃舞浜 ＃格安ホテル ＃ディズニー ＃ディズニーランド ＃ディズニーシー ＃ファミリー ＃グループ ＃４人 ＃幕張メッセ ＃新浦安 ＃卒業旅行… ＜ＵＲＬ＞,0
ユニバ の プロ の 後輩 に 次 ルパン の レストラン やる みたい やん て 聞い て み たら 私 行き ます よ ! て 言っ て た いい なー !,0
レゴランド です が 、 メリーゴーランド ( 馬 じゃなくて 座る だけ 馬車 ) とか 、 コーヒーカップ とか 、 お子さま 様 仕様 の 汽車ぽっぽ まで 、 足 が 悪い 人 は 介添 人 なし で は 乗れ ませ ん 。 って 断ら れ たっ ( ´△｀) まじ か ! 大抵 の 遊園地 は ok なん だけ … < URL >,0
昔 の レゴ は よかっ た よ なあ … 。 欲しい の は 遊園地 で は なく 歴代 レゴ の 展示 。 つまり レゴミュージアム 。 … と ダベ り ながら 外 で 水分 補給 する ところ まで が 大人 の レゴランド 遠足 。 < URL >,0
三重県 から 東京ディズニーランド まで の 交通手段 を 比較 し た ミェ 。 メリット 、 デメリット と 費用 を 調べ た ミェ 。 君 は どれ で ディズニー まで 行く ミェ ? # はてなブログ 三重県民 が 東京ディズニーランド に 遊び に 行く とき の 交通手段 を 比較 し た ! 自家用車 ?…< URL >,0
キッザニア は 流石 企業 様 が 入っ てる から 細部 へ の こだわり が すごく て 見 てる 親 も とても 楽しめ まし た しかし 5時間 ぎっちり 居 た せい か めちゃくちゃ 疲れ た … 1 枠 30分 親 は その間 写真 撮り つつ 死ん だ 顔 でし た,1
"大阪に説明会いくついでにユニバ行こうかな…

お金ないけど…！",0
"やば・・・・・
ドナルドのトゥーンタウンの参加型ショー、私の記憶の一番最初にあるディズニーなんだな
あれで洗脳されたから",0
ディズニーキャラクターのダンボは他の像に比べて何が大きい?<URL>,0
ＦＣで買うのとユニバで買うのどっちがいいと思う？？,0
サニーゴ 欲しい ? ハワイアンズ に 行っ て も 楽しい けど 、 本物 の ハワイ の 世界 を 身体 中 に 感じ て 、 サニーゴ の 感動 を 味わい たい 。 待っ て て サニーゴ ? # 海外 限定 ポケモン を 捕まえ に 行こ う,0
「 2020年 春に オープン 予定 の ベイマックスのハッピーライド 何 月 何 日 に オープン する ?」 の 結果 を 予想 し て み ない ? 4 CAST で 未来 に 起きる こと を 予想 し て 、 インセンティブ に 挑戦 しよ う !# 4 CAST # 未来 予想 # ディズニー … < URL >,0
"八王子市民なのに
サマーランド行ったことない。
誰か行きましょ（笑）",1
派手 髪 3人 ピューロ か ディズニー アホ 旅 し たかっ た けど 私 も もう 戻す し お ひな は 黒髪 ベース が 好き ( 部分 は 好き ),0
今日 は ディズニーシー で たくさん 遊ん で 楽しかっ た でも めっちゃ 楽しみ に し て た 紫 の 忍 転身 来 ちゃっ て 全部 持っ て かれ た ー ほ 、 ほじ い ﾞ … < URL >,0
ハウステンボス の CM 見る たび に 考え ちゃう し 行っ て み たい ぃぃぃってなる ww 重症 ww,0
"ディズニーの大好きなキャラクターからお手紙がもらえる！？
お手紙をもらいたい人はコチラ
⇒＜ＵＲＬ＞

＜ＵＲＬ＞",0
"明日は天皇陛下がハワイアンズのホテルを万全を期すため全館貸切で宿泊されるそうです
新聞で読んだとき真っ先に思い出したのは感謝祭の方言エチュードで「ハワイアンズで告白」というお題で山木氏が「お前のためにハワイアンズ貸し切ったんだ」発…＜ＵＲＬ＞",0
誕生日 前 に 智己 くん が ユニバ 連れ て っ て くれる ん や けど 昨日 、 1d ay ticket + Express path まで 買っ て くれ て しかも 2人 分 や し 、 まあ 出費 汗 1d ay だけ で 良い よ ! 安 つくねん し ! って ゆ ー たら 、 誕生日 や … < URL >,0
#これを見た人は青い画像を貼れ青いか微妙なやつあるけど青いって事にしとくw<url>,0
朝になったらユニバにいると思うとドキドキして眠れない(???ω?)??,1
今木曜から来週火曜日まで母と妹はＥＸＩＬＥツアーとＵＳＪとＴＲＩＢＥ関連のお店巡りと買い物でいません６日も母親がいないなんて最高笑何にも気を使わないし本当に気が楽？本当にストレスだったの分かるあれだけ家族を大事にとか言いながら… ＜ＵＲＬ＞,1
東京ディズニーランドの人気グルメまとめ<URL>#disney#ディズニー,0
